article_idx,article_id,url,title,in_training,dominant_prob_seed42,companion_stability
1295,australia-news/2020/apr/27/national-australia-bank-nab-launches-35bn-capital-raising-as-earnings-hit-by-coronavirus,https://www.theguardian.com/australia-news/2020/apr/27/national-australia-bank-nab-launches-35bn-capital-raising-as-earnings-hit-by-coronavirus,National Australia Bank launches $3.5bn capital raising as earnings hit by coronavirus,no,0.6662,0.4423
1296,australia-news/2020/feb/24/sports-rorts-inquiry-set-to-grill-bridget-mckenzie-and-phil-gaetjens,https://www.theguardian.com/australia-news/2020/feb/24/sports-rorts-inquiry-set-to-grill-bridget-mckenzie-and-phil-gaetjens,Sports rorts inquiry set to grill Bridget McKenzie and Phil Gaetjens,no,0.6346,0.2117
1297,environment/2020/jan/17/climate-change-lawsuit-activists-lose-appeal-sue-us-,https://www.theguardian.com/environment/2020/jan/17/climate-change-lawsuit-activists-lose-appeal-sue-us-,Youth activists lose appeal in landmark lawsuit against US over climate crisis,no,0.7469,0.1929
1298,world/2020/dec/13/us-covid-19-vaccine-rollout-hospitals,https://www.theguardian.com/world/2020/dec/13/us-covid-19-vaccine-rollout-hospitals,'There are many roadblocks': Fears grow over US Covid-19 vaccine rollout,no,0.8145,0.3846
1299,technology/2020/may/20/apple-whistleblower-goes-public-over-lack-of-action,https://www.theguardian.com/technology/2020/may/20/apple-whistleblower-goes-public-over-lack-of-action,Apple whistleblower goes public over 'lack of action',no,0.8609,0.1711
1300,us-news/2019/oct/23/new-jersey-lunch-debt-barred-dances-field-trips,https://www.theguardian.com/us-news/2019/oct/23/new-jersey-lunch-debt-barred-dances-field-trips,'Lunch shaming': New Jersey students with $75 debt barred from dances and trips,no,0.3605,0.1059
1301,us-news/2020/jul/22/voter-identification-laws-cost-taxpayers-36m,https://www.theguardian.com/us-news/2020/jul/22/voter-identification-laws-cost-taxpayers-36m,Revealed: US spends millions of taxpayer dollars on ineffective voting restrictions,no,0.4243,0.2932
1302,media/2020/mar/20/australian-government-asks-netflix-and-stan-to-reduce-data-to-avoid-broadband-overload,https://www.theguardian.com/media/2020/mar/20/australian-government-asks-netflix-and-stan-to-reduce-data-to-avoid-broadband-overload,Australian government asks Netflix and Stan to reduce data to avoid broadband overload,no,0.4086,0.1585
1303,money/2019/jan/23/goldcar-hire-car-insurance-policy-cost-keys,https://www.theguardian.com/money/2019/jan/23/goldcar-hire-car-insurance-policy-cost-keys,Goldcar told me to buy its insurance policy or I’d get no car keys,no,0.8001,0.2913
1304,world/2019/sep/20/taiwan-loses-second-ally-in-a-week-as-kiribati-switches-to-china,https://www.theguardian.com/world/2019/sep/20/taiwan-loses-second-ally-in-a-week-as-kiribati-switches-to-china,Taiwan loses second ally in a week as Kiribati switches to China,no,0.5802,0.2287
1305,australia-news/2019/mar/20/morrison-says-capping-migration-at-160000-is-to-save-budget-bottom-line,https://www.theguardian.com/australia-news/2019/mar/20/morrison-says-capping-migration-at-160000-is-to-save-budget-bottom-line,"Morrison says capping migration at 160,000 is to save budget bottom line",no,0.3711,0.0791
1306,society/2019/may/16/part-privatisation-probation-sevices-to-be-reversed-offender-management-nationalised-chris-grayling,https://www.theguardian.com/society/2019/may/16/part-privatisation-probation-sevices-to-be-reversed-offender-management-nationalised-chris-grayling,Probation will be renationalised after disastrous Grayling reforms,no,0.4907,0.2302
1307,australia-news/2018/oct/03/safe-steps-family-violence-service-investigation-finds-problems-with-workplace-culture,https://www.theguardian.com/australia-news/2018/oct/03/safe-steps-family-violence-service-investigation-finds-problems-with-workplace-culture,Safe Steps: Family violence service investigation finds problems with workplace culture,no,0.5725,0.2659
1308,world/2020/apr/09/parents-weigh-childrens-immunization-health-against-risk-of-exposure-to-covid-19,https://www.theguardian.com/world/2020/apr/09/parents-weigh-childrens-immunization-health-against-risk-of-exposure-to-covid-19,"Delays in childhood vaccinations could lead to outbreaks, experts warn",no,0.7179,0.2643
1309,us-news/2019/may/29/mueller-says-trump-was-not-exonerated-by-his-investigation,https://www.theguardian.com/us-news/2019/may/29/mueller-says-trump-was-not-exonerated-by-his-investigation,Robert Mueller breaks silence to insist he did not exonerate Trump,no,0.6373,0.329
1310,business/2019/may/05/tax-restaurant-owners-california-farmers-climate-change,https://www.theguardian.com/business/2019/may/05/tax-restaurant-owners-california-farmers-climate-change,Here's one tax that restaurant owners just might approve of | Gene Marks,no,0.4693,0.5319
1311,uk-news/2018/dec/16/attack-on-refugee-mother-in-bolton-stokes-local-tension,https://www.theguardian.com/uk-news/2018/dec/16/attack-on-refugee-mother-in-bolton-stokes-local-tension,Attack on refugee family highlights rising hate crime in Bolton,no,0.3295,0.2108
1312,politics/2018/feb/16/business-leader-warns-may-against-harsh-immigration-policy,https://www.theguardian.com/politics/2018/feb/16/business-leader-warns-may-against-harsh-immigration-policy,Business leader warns May against harsh immigration policy,no,0.3238,0.3754
1313,us-news/2018/oct/30/haiti-immigrants-new-york-temporary-protected-status-trump-tps,https://www.theguardian.com/us-news/2018/oct/30/haiti-immigrants-new-york-temporary-protected-status-trump-tps,Flee or hide: Haitian immigrants face difficult decisions under Trump,no,0.5283,0.2122
1314,world/2018/nov/05/pilatus-bank-malta-european-banking-licence-withdrawn,https://www.theguardian.com/world/2018/nov/05/pilatus-bank-malta-european-banking-licence-withdrawn,Malta's Pilatus Bank has European licence withdrawn,no,0.3615,0.1437
1315,business/2019/feb/07/no-deal-brexit-uk-exporters-risk-being-locked-out-of-world-harbours,https://www.theguardian.com/business/2019/feb/07/no-deal-brexit-uk-exporters-risk-being-locked-out-of-world-harbours,No-deal Brexit: UK exporters risk being locked out of world's harbours,no,0.4898,0.2634
1316,us-news/2018/dec/21/us-immigrant-undocumented-families-benefit-programs-chip-snap-deportation-fears,https://www.theguardian.com/us-news/2018/dec/21/us-immigrant-undocumented-families-benefit-programs-chip-snap-deportation-fears,"Undocumented parents scared to enroll citizen children in benefits, say experts",no,0.2848,0.0884
1317,money/2018/dec/08/ethical-gifts-lendwithcare-zimbabwe,https://www.theguardian.com/money/2018/dec/08/ethical-gifts-lendwithcare-zimbabwe,Ethical gifts: let your money work for a small business,no,0.9257,0.3416
1318,us-news/2018/nov/01/donald-trump-white-house-immigration-midterms-speech,https://www.theguardian.com/us-news/2018/nov/01/donald-trump-white-house-immigration-midterms-speech,'Cities of tents': Trump heightens anti-immigrant rhetoric at White House,no,0.4388,0.2095
1319,science/2018/jan/11/farewell-alan-pickup-43-years-of-starwatch,https://www.theguardian.com/science/2018/jan/11/farewell-alan-pickup-43-years-of-starwatch,Starwatch: Farewell and thanks for 43 years of guiding us through the night sky,no,0.4211,0.0756
1320,politics/2018/nov/29/brexit-is-all-at-sea-but-what-course-is-worth-taking,https://www.theguardian.com/politics/2018/nov/29/brexit-is-all-at-sea-but-what-course-is-worth-taking,"Brexit is all at sea, but what course is worth taking? | Letters",no,0.7789,0.3466
1321,media/2017/aug/25/news-corp-channel-switch-leaves-abc-scrambling-to-get-with-the-program,https://www.theguardian.com/media/2017/aug/25/news-corp-channel-switch-leaves-abc-scrambling-to-get-with-the-program,News Corp channel switch leaves ABC scrambling to get with the program | The Weekly Beast,no,0.7492,0.1006
1322,environment/climate-consensus-97-per-cent/2018/oct/26/canada-passed-a-carbon-tax-that-will-give-most-canadians-more-money,https://www.theguardian.com/environment/climate-consensus-97-per-cent/2018/oct/26/canada-passed-a-carbon-tax-that-will-give-most-canadians-more-money,Canada passed a carbon tax that will give most Canadians more money | Dana Nuccitelli,no,0.7176,0.5319
1323,politics/2018/oct/21/nick-clegg-urged-paddy-ashdown-to-stand-up-for-liberalism-and-democracy-at-facebook,https://www.theguardian.com/politics/2018/oct/21/nick-clegg-urged-paddy-ashdown-to-stand-up-for-liberalism-and-democracy-at-facebook,Nick Clegg urged to stand up for liberalism and democracy at Facebook,no,0.3422,0.264
1324,politics/2017/aug/29/labours-new-soft-brexit-policy-could-create-electoral-problems,https://www.theguardian.com/politics/2017/aug/29/labours-new-soft-brexit-policy-could-create-electoral-problems,Labour’s new soft Brexit policy could create electoral problems | Letters,no,0.9126,0.3754
1325,society/2018/mar/05/councils-no-extra-powers-crack-down-empty-homes-housing-crisis,https://www.theguardian.com/society/2018/mar/05/councils-no-extra-powers-crack-down-empty-homes-housing-crisis,Councils still without extra powers to crack down on empty homes,no,0.3918,0.2867
1326,education/2018/may/11/grammar-schools-in-england-to-get-50m-expansion-fund,https://www.theguardian.com/education/2018/may/11/grammar-schools-in-england-to-get-50m-expansion-fund,Grammar schools in England to get £50m expansion fund,no,0.4562,0.2251
1327,business/2016/nov/21/government-pay-to-stay-council-tenants-george-osborne,https://www.theguardian.com/business/2016/nov/21/government-pay-to-stay-council-tenants-george-osborne,Government decides against 'pay to stay' plan for higher-income council tenants,no,0.4934,0.2866
1328,australia-news/2018/apr/25/trumps-pick-for-us-ambassador-to-australia-to-be-sent-to-south-korea,https://www.theguardian.com/australia-news/2018/apr/25/trumps-pick-for-us-ambassador-to-australia-to-be-sent-to-south-korea,Trump's pick for US ambassador to Australia to be sent to South Korea,no,0.5483,0.1495
1329,working-in-development/2017/nov/23/ugandan-orphanages-harming-a-generation,https://www.theguardian.com/working-in-development/2017/nov/23/ugandan-orphanages-harming-a-generation,"No hugs, no one to talk to: how Ugandan orphanages are harming a generation | Helen Nianias",no,0.4481,0.1505
1330,media/2018/jan/10/slow-train-coming-sbs-to-air-17-hour-ghan-train-on-sunday,https://www.theguardian.com/media/2018/jan/10/slow-train-coming-sbs-to-air-17-hour-ghan-train-on-sunday,Slow train coming: SBS to air 17-hour Ghan trip on Sunday,no,0.5942,0.112
1331,world/2017/feb/22/young-refugees-urge-ministers-not-to-end-unaccompanied-minors-scheme,https://www.theguardian.com/world/2017/feb/22/young-refugees-urge-ministers-not-to-end-unaccompanied-minors-scheme,Young refugees urge ministers not to end unaccompanied minors scheme,no,0.4577,0.1076
1332,environment/2017/mar/29/climate-change-companies-challenge-trump-mars-staples-gap,https://www.theguardian.com/environment/2017/mar/29/climate-change-companies-challenge-trump-mars-staples-gap,'Climate change is real': companies challenge Trump's reversal of policy,no,0.5984,0.5319
1333,world/2017/feb/13/scrapping-dubs-refugee-scheme-shameful-stars-tell-theresa-may-unaccompanied-children,https://www.theguardian.com/world/2017/feb/13/scrapping-dubs-refugee-scheme-shameful-stars-tell-theresa-may-unaccompanied-children,Gary Lineker joins stars to condemn scrapping of Dubs refugee scheme,no,0.5207,0.1226
1334,australia-news/2018/may/28/pauline-hanson-swayed-by-newspoll-may-back-company-tax-cut-after-all,https://www.theguardian.com/australia-news/2018/may/28/pauline-hanson-swayed-by-newspoll-may-back-company-tax-cut-after-all,"Tax plan to go to Senate in one hit, opening the door for early poll",no,0.3672,0.2025
1335,us-news/2017/nov/13/trump-nominates-ex-drug-company-executive-as-new-health-secretary,https://www.theguardian.com/us-news/2017/nov/13/trump-nominates-ex-drug-company-executive-as-new-health-secretary,Trump nominates ex-drug company executive as new health secretary,no,0.4021,0.329
1336,technology/2016/oct/13/samsung-galaxy-note-7-recall-expanded,https://www.theguardian.com/technology/2016/oct/13/samsung-galaxy-note-7-recall-expanded,Samsung Galaxy Note 7 recall expanded to 1.9m despite only 96 causing damage,no,0.5372,0.1733
1337,technology/2018/mar/25/driverless-cars-autonomous-vehicles-science-technology-tapper,https://www.theguardian.com/technology/2018/mar/25/driverless-cars-autonomous-vehicles-science-technology-tapper,Being a driverless car passenger proves ‘unsettling and extraordinary’,no,0.5031,0.066
1338,sustainable-business/2017/jun/01/if-humans-are-no-longer-the-smartest-creatures-on-the-planet-we-can-reimagine-our-lives,https://www.theguardian.com/sustainable-business/2017/jun/01/if-humans-are-no-longer-the-smartest-creatures-on-the-planet-we-can-reimagine-our-lives,"If humans are no longer the smartest creatures on the planet, we can reimagine our lives",no,0.2322,0.167
1339,world/2017/dec/28/universities-legally-bound-to-protect-free-speech,https://www.theguardian.com/world/2017/dec/28/universities-legally-bound-to-protect-free-speech,Universities legally bound to protect free speech | Letters,no,0.5113,0.157
1340,education/2017/jun/23/exeter-schools-uniform-resolve-melts-after-boys-skirt-protest,https://www.theguardian.com/education/2017/jun/23/exeter-schools-uniform-resolve-melts-after-boys-skirt-protest,Exeter school’s uniform resolve melts after boys’ skirt protest,no,0.8486,0.2995
1341,media/2016/oct/25/impress-press-regulator-newspaper-publishers-max-moseley,https://www.theguardian.com/media/2016/oct/25/impress-press-regulator-newspaper-publishers-max-moseley,Max Mosley-funded press regulator recognised as state-backed watchdog,no,0.5006,0.3255
1342,media/2016/jul/05/abc-axes-drum-website-in-first-move-by-michelle-guthrie,https://www.theguardian.com/media/2016/jul/05/abc-axes-drum-website-in-first-move-by-michelle-guthrie,ABC closes opinion website the Drum with immediate effect,no,0.4386,0.1193
1343,environment/2016/jun/16/new-rules-to-regulate-europes-hormone-disrupting-chemicals,https://www.theguardian.com/environment/2016/jun/16/new-rules-to-regulate-europes-hormone-disrupting-chemicals,New rules to regulate Europe's hormone-disrupting chemicals,no,0.3985,0.1329
1344,technology/2016/dec/28/2016-the-year-ai-came-of-age,https://www.theguardian.com/technology/2016/dec/28/2016-the-year-ai-came-of-age,2016: the year AI came of age,no,0.5004,0.2456
1345,science/2018/nov/24/sperm-donor-man-who-fathered-200-children,https://www.theguardian.com/science/2018/nov/24/sperm-donor-man-who-fathered-200-children,‘I thought – who will remember me?’: the man who fathered 200 children,no,0.937,0.0771
1346,global-development/2017/aug/22/uk-condemned-shocking-export-deadly-weedkiller-poorer-countries-paraquat,https://www.theguardian.com/global-development/2017/aug/22/uk-condemned-shocking-export-deadly-weedkiller-poorer-countries-paraquat,UK condemned over 'shocking' export of deadly weedkiller to poorer countries,no,0.3799,0.1461
1347,us-news/2017/sep/25/hurricane-harvey-houston-recovery-effort,https://www.theguardian.com/us-news/2017/sep/25/hurricane-harvey-houston-recovery-effort,Houston after Harvey: city faces huge hurdle to recovery,no,0.209,0.0701
1348,us-news/2017/apr/11/the-bernie-sanders-tv-talk-interactive-facebook,https://www.theguardian.com/us-news/2017/apr/11/the-bernie-sanders-tv-talk-interactive-facebook,The Bernie Sanders Show is interactive TV talk for the era of Facebook activism,no,0.488,0.1739
1349,politics/2016/jan/21/neale-coleman-quit-jeremy-corbyn-labour-sidelined-policy,https://www.theguardian.com/politics/2016/jan/21/neale-coleman-quit-jeremy-corbyn-labour-sidelined-policy,Neale Coleman 'quit Corbyn role after being sidelined in policy talks',no,0.6793,0.3466
1350,society/2016/mar/30/damaging-electrical-fitness-workouts-regulated-doctors,https://www.theguardian.com/society/2016/mar/30/damaging-electrical-fitness-workouts-regulated-doctors,"'Damaging' electrical fitness workouts should be regulated, say doctors",no,0.7082,0.4412
1351,politics/2017/apr/18/theresa-may-calls-for-general-election-in-bid-to-secure-brexit-mandate,https://www.theguardian.com/politics/2017/apr/18/theresa-may-calls-for-general-election-in-bid-to-secure-brexit-mandate,Theresa May calls for general election to secure Brexit mandate,no,0.9992,0.3466
1352,us-news/2016/nov/10/barack-obama-donald-trump-white-house-meeting-transition,https://www.theguardian.com/us-news/2016/nov/10/barack-obama-donald-trump-white-house-meeting-transition,Trump and Obama put differences aside in first White House meeting,no,0.5561,0.3289
1353,politics/2016/jul/12/cameron-pushes-for-trident-and-life-chances-plan-at-last-cabinet-meeting,https://www.theguardian.com/politics/2016/jul/12/cameron-pushes-for-trident-and-life-chances-plan-at-last-cabinet-meeting,Cameron pushes for Trident and life chances plan at last cabinet meeting,no,0.7941,0.3754
1354,technology/2016/nov/01/firefox-disable-battery-status-api-tracking,https://www.theguardian.com/technology/2016/nov/01/firefox-disable-battery-status-api-tracking,Firefox disables loophole that allows sites to track users via battery status,no,0.7428,0.1576
1355,politics/2016/jul/09/angela-eagle-who-is-the-woman-taking-on-jeremy-corbyn,https://www.theguardian.com/politics/2016/jul/09/angela-eagle-who-is-the-woman-taking-on-jeremy-corbyn,Angela Eagle: who is the woman taking on Jeremy Corbyn?,no,0.9789,0.3466
1356,society/2015/apr/21/ultra-tory-housing-policy-poor-out-of-barnet,https://www.theguardian.com/society/2015/apr/21/ultra-tory-housing-policy-poor-out-of-barnet,Ultra Tory housing policy aims to push poor people out of Barnet | Patrick Butler,no,0.4376,0.2866
1357,media/2016/oct/14/ripping-into-kim-kardashian-and-kate-fischer-plain-old-bullying-or-public-interest,https://www.theguardian.com/media/2016/oct/14/ripping-into-kim-kardashian-and-kate-fischer-plain-old-bullying-or-public-interest,Ripping into Kim Kardashian and Kate Fischer – plain old bullying or 'public interest'? | Amanda Meade,no,0.3589,0.1801
1358,sustainable-business/2015/oct/12/united-nations-sdg-un-global-compact-sustainability-world-business-council,https://www.theguardian.com/sustainable-business/2015/oct/12/united-nations-sdg-un-global-compact-sustainability-world-business-council,How can companies integrate sustainable development goals?,no,0.2953,0.1604
1359,business/2016/may/29/hinkley-point-c-leave-hedgehogs-nuclear-debacle,https://www.theguardian.com/business/2016/may/29/hinkley-point-c-leave-hedgehogs-nuclear-debacle,Leave Hinkley to the hedgehogs. This debacle needs to be taken in hand,no,0.4741,0.4896
1360,australia-news/2016/jun/28/feral-senate-accusations-reflect-coalitions-frustration-at-not-getting-its-own-way,https://www.theguardian.com/australia-news/2016/jun/28/feral-senate-accusations-reflect-coalitions-frustration-at-not-getting-its-own-way,‘Feral’ Senate accusations reflect Coalition's frustration at not getting its own way,no,0.6126,0.2151
1361,us-news/2015/sep/08/ohio-abortion-clinic-planned-parenthood-cincinnati,https://www.theguardian.com/us-news/2015/sep/08/ohio-abortion-clinic-planned-parenthood-cincinnati,Ohio Planned Parenthood fights back at frontline of new conservative assault,no,0.3935,0.1552
1362,environment/2015/nov/30/how-us-started-to-break-its-fossil-fuel-addiction-12-steps-in-50-years,https://www.theguardian.com/environment/2015/nov/30/how-us-started-to-break-its-fossil-fuel-addiction-12-steps-in-50-years,How the US started to break its fossil fuel addiction – 12 steps in 50 years,no,0.4856,0.5319
1363,australia-news/2014/dec/09/gp-co-payment-change-brings-a-hobsons-choice-that-still-undermines-bulk-billing,https://www.theguardian.com/australia-news/2014/dec/09/gp-co-payment-change-brings-a-hobsons-choice-that-still-undermines-bulk-billing,GP co-payment change brings a Hobson's choice that still undermines bulk billing,no,0.5579,0.2942
1364,world/2016/apr/17/refugee-family-fled-syria-france-face-explusion-dublin-regulation,https://www.theguardian.com/world/2016/apr/17/refugee-family-fled-syria-france-face-explusion-dublin-regulation,Syrian family who fled Homs for safety get a cold shoulder from France,no,0.6244,0.0896
1365,us-news/2016/aug/24/california-homelessness-santa-cruz-housing-affordability,https://www.theguardian.com/us-news/2016/aug/24/california-homelessness-santa-cruz-housing-affordability,'It’s a catastrophe': low-income workers get priced out of California beach city,no,0.5267,0.0708
1366,world/2016/feb/17/note-to-giles-fraser-staying-in-the-eu-helps-to-level-the-field,https://www.theguardian.com/world/2016/feb/17/note-to-giles-fraser-staying-in-the-eu-helps-to-level-the-field,Note to Giles Fraser: staying in the EU helps to level the field | Letters,no,0.4158,0.3346
1367,australia-news/2015/dec/07/warren-truss-asserts-nationals-demand-for-more-cabinet-spots-after-defection,https://www.theguardian.com/australia-news/2015/dec/07/warren-truss-asserts-nationals-demand-for-more-cabinet-spots-after-defection,Warren Truss asserts Nationals' demand for more cabinet spots after defection,no,0.534,0.1911
1368,media/2015/nov/06/kerry-obrien-resigns-from-abc-taking-his-many-awards-but-leaving-a-legacy,https://www.theguardian.com/media/2015/nov/06/kerry-obrien-resigns-from-abc-taking-his-many-awards-but-leaving-a-legacy,"Kerry O'Brien resigns from ABC, taking his many awards but leaving a legacy",no,0.5406,0.0732
1369,uk-news/2015/jul/07/george-osborne-trading-laws-small-retailers-budget,https://www.theguardian.com/uk-news/2015/jul/07/george-osborne-trading-laws-small-retailers-budget,"George Osborne's new Sunday trading laws endanger small stores, say retailers",no,0.6029,0.3613
1370,world/2015/jun/02/south-china-sea-australia-wont-rule-out-expanded-surveillance-flights,https://www.theguardian.com/world/2015/jun/02/south-china-sea-australia-wont-rule-out-expanded-surveillance-flights,South China Sea: Australia won't rule out expanded surveillance flights,no,0.5331,0.142
1371,politics/2015/may/19/boost-farage-patrick-oflynn-quits-role-apologises-ukip,https://www.theguardian.com/politics/2015/may/19/boost-farage-patrick-oflynn-quits-role-apologises-ukip,Boost for Farage as Patrick O'Flynn and Suzanne Evans quit roles,no,0.5618,0.3346
1372,world/2016/may/12/women-sexual-harrassment-sexism-deescalation,https://www.theguardian.com/world/2016/may/12/women-sexual-harrassment-sexism-deescalation,The struggle to speak up: how women are pushed to de-escalate sexist incidents,no,0.6067,0.174
1373,politics/blog/2015/may/25/labour-eu-referendum-uturn-realistic-or-feeble,https://www.theguardian.com/politics/blog/2015/may/25/labour-eu-referendum-uturn-realistic-or-feeble,Labour's EU referendum U-turn: realistic or feeble?,no,0.9988,0.3515
1374,sustainable-business/walmart-sustainable-seafood-alaskan-salmon,https://www.theguardian.com/sustainable-business/walmart-sustainable-seafood-alaskan-salmon,New Walmart guidelines put Alaskan salmon back on the menu,no,0.4352,0.1844
1375,australia-news/2015/jul/17/labor-to-demand-bishop-resign-if-forms-show-flight-claimed-as-official-business,https://www.theguardian.com/australia-news/2015/jul/17/labor-to-demand-bishop-resign-if-forms-show-flight-claimed-as-official-business,Labor to demand Bishop resign if forms show flight claimed as official business,no,0.7562,0.2117
1376,technology/2014/jun/06/swift-developers-guide-apple-programming-language-wwdc,https://www.theguardian.com/technology/2014/jun/06/swift-developers-guide-apple-programming-language-wwdc,Swift: a developer's guide to Apple's new programming language,no,0.5571,0.1582
1377,technology/2014/sep/24/us-regulators-bitcoin-butterfly-labs,https://www.theguardian.com/technology/2014/sep/24/us-regulators-bitcoin-butterfly-labs,US regulators seek shutdown of bitcoin PC specialist Butterfly Labs,no,0.4651,0.0819
1378,environment/2015/jan/22/australia-a-leader-on-trade-but-lags-on-environment-in-development-index,https://www.theguardian.com/environment/2015/jan/22/australia-a-leader-on-trade-but-lags-on-environment-in-development-index,Australia a leader on trade but lags on environment in development index,no,0.4441,0.3015
1379,public-leaders-network/2014/oct/10/local-taxes-vote-japan-ichikawa-charity-1-percent,https://www.theguardian.com/public-leaders-network/2014/oct/10/local-taxes-vote-japan-ichikawa-charity-1-percent,Want to give some of your local taxes to charity? In Japan you can,no,0.3001,0.1422
1380,business/grogonomics/2015/mar/09/intergenerational-report-assumptions-about-government-spending-are-a-confusion-of-idiocy,https://www.theguardian.com/business/grogonomics/2015/mar/09/intergenerational-report-assumptions-about-government-spending-are-a-confusion-of-idiocy,Intergenerational report: assumptions about government spending are a confusion of idiocy,no,0.924,0.2704
1381,world/2015/nov/02/investigatory-powers-bill-snoopers-charter-will-remain-firmly-in-place,https://www.theguardian.com/world/2015/nov/02/investigatory-powers-bill-snoopers-charter-will-remain-firmly-in-place,Investigatory powers bill: snooper's charter to remain firmly in place,no,0.6404,0.2037
1382,world/2014/jun/02/wayne-swan-accuses-coalition-of-using-budget-to-wage-class-war,https://www.theguardian.com/world/2014/jun/02/wayne-swan-accuses-coalition-of-using-budget-to-wage-class-war,Wayne Swan accuses Coalition of using its budget to wage class war,no,0.3329,0.1753
1383,media/2014/jun/02/bassem-youssef-closes-egyptian-satire-tv-show-over-safety-fears,https://www.theguardian.com/media/2014/jun/02/bassem-youssef-closes-egyptian-satire-tv-show-over-safety-fears,Egyptian satirist Bassem Youssef winds up TV show due to safety fears,no,0.6202,0.1622
