article_idx,article_id,url,title,in_training,dominant_prob_seed42,companion_stability
0,us-news/2025/apr/05/covid-policies-lockdown-masks-liberals-book,https://www.theguardian.com/us-news/2025/apr/05/covid-policies-lockdown-masks-liberals-book,‘A case study in groupthink’: were liberals wrong about the pandemic?,yes,0.532,0.1385
1,taking-the-step-to-tomorrows-heating/2025/may/06/britain-on-heat-pumps-how-switching-helps-the-planet,https://www.theguardian.com/taking-the-step-to-tomorrows-heating/2025/may/06/britain-on-heat-pumps-how-switching-helps-the-planet,This is Britain on heat pumps: how a nationwide switch could help our planet,yes,0.9837,0.2131
2,australia-news/2025/aug/04/last-resort-when-the-only-option-left-amid-australias-housing-crisis-is-a-motel-ntwnfb,https://www.theguardian.com/australia-news/2025/aug/04/last-resort-when-the-only-option-left-amid-australias-housing-crisis-is-a-motel-ntwnfb,Last resort: when the only option left amid Australia’s housing crisis is a motel,yes,0.4574,0.0874
3,politics/article/2024/may/26/rishi-sunaks-national-service-pledge-is-bonkers-says-ex-military-chief,https://www.theguardian.com/politics/article/2024/may/26/rishi-sunaks-national-service-pledge-is-bonkers-says-ex-military-chief,"Rishi Sunak’s national service pledge is ‘bonkers’, says ex-military chief",yes,0.5427,0.2983
4,politics/2025/jul/13/many-happy-returns-economic-policy-target-wellbeing-covid,https://www.theguardian.com/politics/2025/jul/13/many-happy-returns-economic-policy-target-wellbeing-covid,Why Labour should target happiness alongside economic growth | Heather Stewart,yes,0.2558,0.2224
5,society/2023/nov/11/hackney-walk-east-london-regeneration-ghost-town,https://www.theguardian.com/society/2023/nov/11/hackney-walk-east-london-regeneration-ghost-town,‘It was a case study for what not to do’: the regeneration project that became a £100m luxury ghost town,yes,0.6446,0.0991
6,science/2025/may/30/vet-complaint-process-in-uk-often-stacked-against-pet-owners,https://www.theguardian.com/science/2025/may/30/vet-complaint-process-in-uk-often-stacked-against-pet-owners,Vet complaint process in UK often ‘stacked against pet owners’,yes,0.484,0.041
7,money/2025/mar/07/crypto-scam-victims,https://www.theguardian.com/money/2025/mar/07/crypto-scam-victims,"‘You get sucked in’: crypto scam victims on how they lost up to £162,000",yes,0.7197,0.3517
8,technology/2025/aug/05/productivity-commission-digital-economy-report-copyright-rules-text-and-data-mining-to-train-ai-models,https://www.theguardian.com/technology/2025/aug/05/productivity-commission-digital-economy-report-copyright-rules-text-and-data-mining-to-train-ai-models,Should big tech be allowed to mine Australians’ text and data to train AI? The Productivity Commission is considering it,yes,0.425,0.108
9,uk-news/2025/may/31/transport-for-london-tfl-blocks-ads-bpas-decriminalise-abortion,https://www.theguardian.com/uk-news/2025/may/31/transport-for-london-tfl-blocks-ads-bpas-decriminalise-abortion,TfL blocks ads calling on people to lobby MPs to decriminalise abortion,yes,0.3466,0.3725
10,world/2025/apr/17/uyghur-rights-group-calls-on-hotel-chains-not-to-sanitise-china-abuses-in-xinjiang,https://www.theguardian.com/world/2025/apr/17/uyghur-rights-group-calls-on-hotel-chains-not-to-sanitise-china-abuses-in-xinjiang,Uyghur rights group calls on hotel chains not to ‘sanitise’ China abuses in Xinjiang,yes,0.384,0.1213
11,uk-news/2025/mar/25/online-gangs-teenage-boys-sharing-extreme-material-emerging-threat-uk,https://www.theguardian.com/uk-news/2025/mar/25/online-gangs-teenage-boys-sharing-extreme-material-emerging-threat-uk,Online gangs of teenage boys sharing extreme material are ‘emerging threat’ in UK,yes,0.3036,0.3221
12,money/2024/oct/05/the-solo-penalty-from-rent-to-holidays-being-single-is-costing-me-12000-extra-a-year,https://www.theguardian.com/money/2024/oct/05/the-solo-penalty-from-rent-to-holidays-being-single-is-costing-me-12000-extra-a-year,"The solo penalty, from rent to holidays: ‘Being single is costing me £12,000 extra a year’",yes,0.9995,0.2515
13,money/2024/dec/18/what-are-waspi-women-and-why-do-they-feel-betrayed-over-pensions,https://www.theguardian.com/money/2024/dec/18/what-are-waspi-women-and-why-do-they-feel-betrayed-over-pensions,Who are the ‘Waspi women’ and why do they feel betrayed over pensions?,yes,0.4314,0.1999
14,australia-news/2024/mar/28/nsw-may-be-forced-to-pay-150m-a-year-to-extend-life-of-coal-fired-plant-energy-expert-predicts,https://www.theguardian.com/australia-news/2024/mar/28/nsw-may-be-forced-to-pay-150m-a-year-to-extend-life-of-coal-fired-plant-energy-expert-predicts,"NSW may be forced to pay $150m a year to extend life of coal-fired plant, energy expert predicts",yes,0.4987,0.5319
15,australia-news/2024/sep/12/australias-aged-care-overhaul-what-are-the-changes-and-will-you-have-to-pay-more,https://www.theguardian.com/australia-news/2024/sep/12/australias-aged-care-overhaul-what-are-the-changes-and-will-you-have-to-pay-more,"Australia’s aged care overhaul: what are the changes, and will you have to pay more?",yes,0.5189,0.1595
16,society/article/2024/jul/25/harm-from-problem-gambling-in-uk-may-be-eight-times-higher-than-thought-research-finds,https://www.theguardian.com/society/article/2024/jul/25/harm-from-problem-gambling-in-uk-may-be-eight-times-higher-than-thought-research-finds,Harm from problem gambling in Great Britain ‘may be eight times higher than thought’,yes,0.4665,0.0922
17,business/2025/may/03/inside-the-marks-and-spencer-cyber-attack-chaos,https://www.theguardian.com/business/2025/may/03/inside-the-marks-and-spencer-cyber-attack-chaos,"Clothing shortages, food waste and millions lost each day: inside the M&S cyber-attack chaos",yes,0.7332,0.1283
18,media/2025/may/23/weekly-beast-nick-mckenzie-secret-recording-ben-roberts-smith-sky-news-ntwnfb,https://www.theguardian.com/media/2025/may/23/weekly-beast-nick-mckenzie-secret-recording-ben-roberts-smith-sky-news-ntwnfb,Court’s nuanced analysis of Nick McKenzie’s secret recording in Ben Roberts-Smith appeal a far cry from Sky News claims ,yes,0.3544,0.1334
19,australia-news/article/2024/sep/10/steadfast-group-insurance-broker-four-corners-report,https://www.theguardian.com/australia-news/article/2024/sep/10/steadfast-group-insurance-broker-four-corners-report,Steadfast Group announces review after Four Corners report alleged brokers hid cheaper quote from rival,yes,0.6633,0.2843
20,society/2024/nov/05/digital-tech-rich-opportunities-child-development-study,https://www.theguardian.com/society/2024/nov/05/digital-tech-rich-opportunities-child-development-study,"Digital tech can offer rich opportunities for child development, study says",yes,0.5176,0.3625
21,business/2023/nov/02/australian-academics-apologise-for-false-ai-generated-allegations-against-big-four-consultancy-firms,https://www.theguardian.com/business/2023/nov/02/australian-academics-apologise-for-false-ai-generated-allegations-against-big-four-consultancy-firms,Australian academics apologise for false AI-generated allegations against big four consultancy firms,yes,0.6805,0.2843
22,uk-news/2025/feb/27/martin-lewis-charity-money-worries-mental-health-policy-institute,https://www.theguardian.com/uk-news/2025/feb/27/martin-lewis-charity-money-worries-mental-health-policy-institute,‘We have to protect people’: Martin Lewis on his fight to stop money worries worsening mental health,yes,0.528,0.4896
23,global-development/2025/mar/03/those-of-us-who-rely-on-aid-must-accept-the-new-reality-and-shape-our-own-destiny,https://www.theguardian.com/global-development/2025/mar/03/those-of-us-who-rely-on-aid-must-accept-the-new-reality-and-shape-our-own-destiny,Those who depend on aid must embrace Trump’s bombshell and shape their own destiny | Janet Mawiyoo,yes,0.2588,0.0638
24,science/2025/feb/23/forensic-science-centre-that-inspired-bbc-show-traces-at-risk-of-closure,https://www.theguardian.com/science/2025/feb/23/forensic-science-centre-that-inspired-bbc-show-traces-at-risk-of-closure,Forensic science centre that inspired BBC show Traces at risk of closure,yes,0.3674,0.0853
25,news/ng-interactive/2025/may/24/something-has-gone-very-wrong-how-the-carers-scandal-was-exposed,https://www.theguardian.com/news/ng-interactive/2025/may/24/something-has-gone-very-wrong-how-the-carers-scandal-was-exposed,‘Something has gone very wrong’: how the carers scandal was exposed,yes,0.9181,0.2801
26,uk-news/2024/feb/26/northumberland-line-passenger-trains-return,https://www.theguardian.com/uk-news/2024/feb/26/northumberland-line-passenger-trains-return,‘Proper exciting’: passenger trains to return to Northumberland Line after 60 years,yes,0.859,0.0705
27,environment/2025/apr/02/ministers-lose-appeal-against-yorkshire-anglers-river-pollution-ruling,https://www.theguardian.com/environment/2025/apr/02/ministers-lose-appeal-against-yorkshire-anglers-river-pollution-ruling,Environment secretary’s appeal against Yorkshire river pollution ruling fails,yes,0.5785,0.3602
28,law/2024/dec/06/busybody-fines-up-42-in-2023-in-england-and-wales-report-shows,https://www.theguardian.com/law/2024/dec/06/busybody-fines-up-42-in-2023-in-england-and-wales-report-shows,"‘Busybody’ fines up 42% in 2023 in England and Wales, report shows",yes,0.3486,0.2801
29,world/2024/jan/16/new-zealand-government-voting-age-change-rejected-minimum-terms-parliament,https://www.theguardian.com/world/2024/jan/16/new-zealand-government-voting-age-change-rejected-minimum-terms-parliament,New Zealand government rejects Ardern-era bid to lower voting age,yes,0.6037,0.2645
30,australia-news/2022/dec/24/morally-questionable-compliance-element-should-be-scrapped-from-controversial-parentsnext-scheme-mps-told,https://www.theguardian.com/australia-news/2022/dec/24/morally-questionable-compliance-element-should-be-scrapped-from-controversial-parentsnext-scheme-mps-told,"‘Morally questionable’: compliance element should be scrapped from controversial ParentsNext scheme, MPs told",yes,0.9211,0.1784
31,uk-news/2025/jun/24/english-heritage-chief-nick-merriman-steps-down-after-overseeing-controversial-cost-cuts,https://www.theguardian.com/uk-news/2025/jun/24/english-heritage-chief-nick-merriman-steps-down-after-overseeing-controversial-cost-cuts,English Heritage chief steps down after overseeing controversial cost cuts,yes,0.4308,0.2791
32,environment/2022/jun/09/david-littleprouds-coal-case-study-to-defend-coalition-energy-policy-is-something-of-a-credibility-stretch,https://www.theguardian.com/environment/2022/jun/09/david-littleprouds-coal-case-study-to-defend-coalition-energy-policy-is-something-of-a-credibility-stretch,David Littleproud’s coal case study to defend Coalition energy policy is something of a credibility stretch | Temperatur,yes,0.5864,0.5319
33,uk-news/article/2024/may/20/scotland-vulnerable-marine-protection-areas,https://www.theguardian.com/uk-news/article/2024/may/20/scotland-vulnerable-marine-protection-areas,"Scotland’s vulnerable marine life not properly protected, campaigners warn",yes,0.5012,0.5364
34,us-news/article/2024/jun/17/between-hollow-rhetoric-and-war-how-sanctions-work-and-why-they-often-dont,https://www.theguardian.com/us-news/article/2024/jun/17/between-hollow-rhetoric-and-war-how-sanctions-work-and-why-they-often-dont,Between hollow rhetoric and war: how sanctions work – and why they often don’t,yes,0.3817,0.2287
35,uk-news/2025/jun/01/southport-attack-unrest-1958-race-riots-2011-disorder-far-right-protests,https://www.theguardian.com/uk-news/2025/jun/01/southport-attack-unrest-1958-race-riots-2011-disorder-far-right-protests,"Riots after Southport attack more similar to those in 1958 than in 2011, study finds",yes,0.2582,0.248
36,business/2024/sep/24/minister-naming-and-shaming-tulip-siddiq-financial-conduct-authority,https://www.theguardian.com/business/2024/sep/24/minister-naming-and-shaming-tulip-siddiq-financial-conduct-authority,Minister urges UK financial regulator to rethink ‘naming and shaming’ plan,yes,0.4926,0.2745
37,environment/2025/apr/25/public-affairs-firms-in-europe-enable-pollution-by-lobbying-for-big-oil-says-analysis,https://www.theguardian.com/environment/2025/apr/25/public-affairs-firms-in-europe-enable-pollution-by-lobbying-for-big-oil-says-analysis,"Public affairs firms in Europe enable pollution by lobbying for big oil, says analysis",yes,0.4331,0.5083
38,society/2024/apr/19/unpaid-carers-not-claiming-allowance-benefit,https://www.theguardian.com/society/2024/apr/19/unpaid-carers-not-claiming-allowance-benefit,"Half a million unpaid carers in UK not claiming £4,200 a year benefit",yes,0.9245,0.2917
39,australia-news/article/2024/may/22/medical-cannabis-driving-trial-australia-dui-roadside-drug-impairment-test,https://www.theguardian.com/australia-news/article/2024/may/22/medical-cannabis-driving-trial-australia-dui-roadside-drug-impairment-test,Medical cannabis: cross-party committee says Australia needs new roadside impairment test,yes,0.4056,0.3365
40,environment/2024/feb/12/england-brings-in-biodiversity-net-gain-rules-to-force-builders-to-compensate-for-loss-of-nature,https://www.theguardian.com/environment/2024/feb/12/england-brings-in-biodiversity-net-gain-rules-to-force-builders-to-compensate-for-loss-of-nature,England brings in biodiversity rules to force builders to compensate for loss of nature,yes,0.5867,0.5364
41,world/article/2024/may/21/first-edition-iran-ebrahim-raisi,https://www.theguardian.com/world/article/2024/may/21/first-edition-iran-ebrahim-raisi,Tuesday briefing: What the death of Ebrahim Raisi means for Iran’s political future,yes,0.4085,0.2962
42,us-news/2024/nov/07/4b-movement-trump-women,https://www.theguardian.com/us-news/2024/nov/07/4b-movement-trump-women,‘No man will touch me until I have my rights back’: why is the 4B movement going viral after Trump’s win?,yes,0.3403,0.248
43,science/article/2024/jun/20/global-emergency-preparation-food-storage-grain,https://www.theguardian.com/science/article/2024/jun/20/global-emergency-preparation-food-storage-grain,Economist suggests storing grain to prepare for next global emergency,yes,0.554,0.3194
44,australia-news/article/2024/aug/15/landmark-report-on-murdered-indigenous-women-condemned-as-weak-and-toothless,https://www.theguardian.com/australia-news/article/2024/aug/15/landmark-report-on-murdered-indigenous-women-condemned-as-weak-and-toothless,Landmark report on murdered Indigenous women condemned as ‘weak’ and ‘toothless’,yes,0.7236,0.2255
45,us-news/2025/mar/24/eggs-inflation-american-culture,https://www.theguardian.com/us-news/2025/mar/24/eggs-inflation-american-culture,Shell-shocked! Why eggs – and their rising price – are an American obsession,yes,0.655,0.0842
46,society/2024/mar/29/financial-abuse-can-follow-victims-long-after-relationships-end-australian-experts-are-calling-for-reform,https://www.theguardian.com/society/2024/mar/29/financial-abuse-can-follow-victims-long-after-relationships-end-australian-experts-are-calling-for-reform,Financial abuse can follow victims long after relationships end. Australian experts are calling for reform,yes,0.3884,0.1946
47,australia-news/article/2024/sep/11/queensland-children-police-watch-houses-watchdog-report,https://www.theguardian.com/australia-news/article/2024/sep/11/queensland-children-police-watch-houses-watchdog-report,"Sick and suicidal children held in Queensland police watch houses for weeks without healthcare, watchdog reveals",yes,0.4171,0.27
48,science/2025/may/19/junk-science-vaccine-refusers-and-the-return-of-smallpox-what-worries-one-of-australias-top-epidemiologists,https://www.theguardian.com/science/2025/may/19/junk-science-vaccine-refusers-and-the-return-of-smallpox-what-worries-one-of-australias-top-epidemiologists,"Junk science, vaccine refusers and the return of smallpox: what worries one of Australia’s top epidemiologists",yes,0.9513,0.3846
49,world/2024/oct/31/thursday-briefing-what-you-need-to-know-about-rachel-reevess-plans-for-the-economy,https://www.theguardian.com/world/2024/oct/31/thursday-briefing-what-you-need-to-know-about-rachel-reevess-plans-for-the-economy,Thursday briefing: What you need to know about Rachel Reeves’s plans for the economy,yes,0.4295,0.3734
50,society/2024/mar/31/why-the-tavistock-gender-identity-clinic-was-forced-to-shut-and-what-happens-next,https://www.theguardian.com/society/2024/mar/31/why-the-tavistock-gender-identity-clinic-was-forced-to-shut-and-what-happens-next,Why the Tavistock gender identity clinic was forced to shut ... and what happens next,yes,0.8976,0.3986
51,australia-news/article/2024/jul/24/queensland-failed-to-act-on-report-into-devastating-experiences-of-people-with-disability-in-justice-system,https://www.theguardian.com/australia-news/article/2024/jul/24/queensland-failed-to-act-on-report-into-devastating-experiences-of-people-with-disability-in-justice-system,Queensland failed to act on report into ‘devastating’ experiences of people with disability in justice system,yes,0.6042,0.5725
52,technology/2025/mar/22/we-need-to-set-the-terms-or-were-all-screwed-how-newsrooms-are-tackling-ais-uncertainties-and-opportunities,https://www.theguardian.com/technology/2025/mar/22/we-need-to-set-the-terms-or-were-all-screwed-how-newsrooms-are-tackling-ais-uncertainties-and-opportunities,‘We need to set the terms or we’re all screwed’: how newsrooms are tackling AI’s uncertainties and opportunities,yes,0.2765,0.1384
53,global-development/2025/mar/02/this-will-cost-lives-cuts-to-uk-aid-budget-condemned-as-betrayal-by-international-development-groups,https://www.theguardian.com/global-development/2025/mar/02/this-will-cost-lives-cuts-to-uk-aid-budget-condemned-as-betrayal-by-international-development-groups,‘This will cost lives’: cuts to UK aid budget condemned as ‘betrayal’ by international development groups,yes,0.2774,0.1064
54,technology/2025/may/21/every-person-that-clashed-with-him-has-left-the-rise-fall-and-spectacular-comeback-of-sam-altman,https://www.theguardian.com/technology/2025/may/21/every-person-that-clashed-with-him-has-left-the-rise-fall-and-spectacular-comeback-of-sam-altman,"‘Every person that clashed with him has left’: the rise, fall and spectacular comeback of Sam Altman",yes,0.3482,0.077
55,law/2023/mar/07/australia-federal-human-rights-act-commission-targets-robodebt-covid-policies-indefinite-detention,https://www.theguardian.com/law/2023/mar/07/australia-federal-human-rights-act-commission-targets-robodebt-covid-policies-indefinite-detention,"AHRC targets robodebt, Covid policies and indefinite detention in push for federal human rights act",yes,0.5579,0.2439
56,society/2024/jan/22/nhs-drug-shortages-are-partly-a-political-failure,https://www.theguardian.com/society/2024/jan/22/nhs-drug-shortages-are-partly-a-political-failure,NHS drug shortages are partly a political failure | Letters,yes,0.4371,0.3429
57,australia-news/2024/dec/06/two-australian-teens-convicted-under-counter-terrorism-laws-as-afp-and-asio-warn-of-early-signs-of-radicalisation,https://www.theguardian.com/australia-news/2024/dec/06/two-australian-teens-convicted-under-counter-terrorism-laws-as-afp-and-asio-warn-of-early-signs-of-radicalisation,AFP and Asio warn of ‘shocking’ numbers of teens in terrorism cases,yes,0.3723,0.2189
58,environment/2025/jul/22/in-a-bombed-out-reservoir-ukraine-huge-forest-grown-a-return-to-life-or-toxic-timebomb,https://www.theguardian.com/environment/2025/jul/22/in-a-bombed-out-reservoir-ukraine-huge-forest-grown-a-return-to-life-or-toxic-timebomb,In Ukraine’s bombed out reservoir a huge forest has grown – is it a return to life or a toxic timebomb?,yes,0.7911,0.5364
59,world/2024/dec/14/west-africa-architectural-heritage-lome-togo,https://www.theguardian.com/world/2024/dec/14/west-africa-architectural-heritage-lome-togo,"Restore, destroy or leave to rot? Battle lines drawn over west Africa’s architectural heritage",yes,0.3048,0.0797
60,society/article/2024/jun/17/teachers-gps-staggering-extra-demands-poverty-great-britain,https://www.theguardian.com/society/article/2024/jun/17/teachers-gps-staggering-extra-demands-poverty-great-britain,Teachers and GPs ‘staggering’ under extra demands caused by poverty in Great Britain,yes,0.5091,0.2967
61,australia-news/2023/jul/07/how-the-coalition-collaborated-with-friendly-media-to-silence-robodebt-victims,https://www.theguardian.com/australia-news/2023/jul/07/how-the-coalition-collaborated-with-friendly-media-to-silence-robodebt-victims,How the Coalition collaborated with ‘friendly media’ to silence robodebt victims,yes,0.9989,0.1437
62,australia-news/article/2024/may/08/home-affairs-savaged-by-australian-audit-office-for-poor-oversight-of-dodgy-migration-agents,https://www.theguardian.com/australia-news/article/2024/may/08/home-affairs-savaged-by-australian-audit-office-for-poor-oversight-of-dodgy-migration-agents,Home affairs savaged by Australian audit office for poor oversight of dodgy migration agents,yes,0.6711,0.2427
63,uk-news/2024/feb/23/community-capital-ownerless-scottish-properties-to-be-offered-to-local-schemes,https://www.theguardian.com/uk-news/2024/feb/23/community-capital-ownerless-scottish-properties-to-be-offered-to-local-schemes,Ownerless Scottish properties to be handed to local communities,yes,0.375,0.1858
64,australia-news/2024/apr/18/sydney-church-stabbing-social-media-posts-facebook-taken-down-nsw-premier-chris-minns-ntwnfb,https://www.theguardian.com/australia-news/2024/apr/18/sydney-church-stabbing-social-media-posts-facebook-taken-down-nsw-premier-chris-minns-ntwnfb,Sydney church stabbing: social media pages ‘infamous’ for spreading misinformation taken down,yes,0.3035,0.1781
65,politics/2023/oct/07/labour-vows-to-double-number-of-scanners-in-hospitals-in-england,https://www.theguardian.com/politics/2023/oct/07/labour-vows-to-double-number-of-scanners-in-hospitals-in-england,Labour vows to double number of scanners in hospitals in England,yes,0.5273,0.3754
66,society/article/2024/sep/09/marias-niece-sought-a-dvo-her-ex-partner-bought-an-axe-ntwnfb,https://www.theguardian.com/society/article/2024/sep/09/marias-niece-sought-a-dvo-her-ex-partner-bought-an-axe-ntwnfb,Maria’s niece sought a DVO to protect her. Her ex-partner went out and bought an axe,yes,0.9742,0.4491
67,us-news/2024/oct/02/middle-east-hurricane-helene-dockworker-strikes-kamala-harris,https://www.theguardian.com/us-news/2024/oct/02/middle-east-hurricane-helene-dockworker-strikes-kamala-harris,"Harris faces triple trouble, even before October’s inevitable surprises",yes,0.6417,0.2801
68,politics/article/2024/jun/04/election-edition-itv-leaders-debate-sunak-starmer,https://www.theguardian.com/politics/article/2024/jun/04/election-edition-itv-leaders-debate-sunak-starmer,"Campaign catchup: Debate looming, Farage soaking, Whitby Woman rebelling",yes,0.6283,0.3466
69,world/2023/sep/24/political-outsider-stefanos-kasselakis-wins-race-to-lead-greeces-syriza,https://www.theguardian.com/world/2023/sep/24/political-outsider-stefanos-kasselakis-wins-race-to-lead-greeces-syriza,Political outsider Stefanos Kasselakis wins race to lead Greece’s Syriza,yes,0.4098,0.2119
70,us-news/2025/jul/26/elon-musk-tesla-diner-hollywood,https://www.theguardian.com/us-news/2025/jul/26/elon-musk-tesla-diner-hollywood,Elon Musk opened a diner in Hollywood. What could go wrong? I went to find out,yes,0.3182,0.0929
71,business/2023/jun/27/mobile-and-broadband-firms-accused-of-fuelling-uk-greedflation-with-major-price-hikes,https://www.theguardian.com/business/2023/jun/27/mobile-and-broadband-firms-accused-of-fuelling-uk-greedflation-with-major-price-hikes,Mobile and broadband firms accused of fuelling UK ‘greedflation’ with major price hikes,yes,0.8383,0.3906
72,us-news/2024/oct/08/shasta-county-elections-redding-far-right-voting-covid,https://www.theguardian.com/us-news/2024/oct/08/shasta-county-elections-redding-far-right-voting-covid,Extremist politics divided this conservative California community. What will it take to turn the tide?,yes,0.669,0.3175
73,world/2025/jan/08/wednesday-briefing-what-elon-musks-focus-on-grooming-gangs-reveals-about-alt-right-online-discourse,https://www.theguardian.com/world/2025/jan/08/wednesday-briefing-what-elon-musks-focus-on-grooming-gangs-reveals-about-alt-right-online-discourse,Wednesday briefing: What Elon Musk’s focus on grooming gangs reveals about alt-right online discourse,yes,0.3511,0.248
74,society/2024/nov/28/im-emotionally-ruined-mps-left-bitterly-divided-over-assisted-dying-bill,https://www.theguardian.com/society/2024/nov/28/im-emotionally-ruined-mps-left-bitterly-divided-over-assisted-dying-bill,"‘I’m emotionally ruined’: MPs bitterly divided over assisted dying, with Starmer appalled by ministers’ comments",yes,0.618,0.2686
75,business/2022/dec/02/half-a-million-vulnerable-households-miss-out-on-help-with-energy-bills,https://www.theguardian.com/business/2022/dec/02/half-a-million-vulnerable-households-miss-out-on-help-with-energy-bills,Half a million vulnerable households miss out on help with energy bills,yes,0.7391,0.3094
76,society/2023/nov/01/pig-heart-transplant-faucette-dies,https://www.theguardian.com/society/2023/nov/01/pig-heart-transplant-faucette-dies,World’s second human recipient of pig heart dies six weeks after operation,yes,0.4282,0.2828
77,world/2025/mar/06/thursday-briefing-what-a-new-report-reveals-about-the-mothers-being-killed-by-their-sons,https://www.theguardian.com/world/2025/mar/06/thursday-briefing-what-a-new-report-reveals-about-the-mothers-being-killed-by-their-sons,Thursday briefing: What a new report reveals about the mothers being killed by their sons,yes,0.3604,0.2782
