article_idx,article_id,url,title,in_training,dominant_prob_seed42,companion_stability
494,politics/2019/dec/05/memes-shares-and-arguments-how-do-people-consume-election-news-on-their-phones,https://www.theguardian.com/politics/2019/dec/05/memes-shares-and-arguments-how-do-people-consume-election-news-on-their-phones,Secrets of their smartphones: see how voters follow the news in memes,no,0.3997,0.2089
495,australia-news/2018/jun/06/senate-inquiry-calls-for-sweeping-political-donations-ban,https://www.theguardian.com/australia-news/2018/jun/06/senate-inquiry-calls-for-sweeping-political-donations-ban,Senate inquiry calls for sweeping political donations ban,no,0.6125,0.1496
496,global-development/2019/dec/17/were-bonded-like-sisters-the-choir-giving-trafficked-women-a-voice-amies-freedom-choir,https://www.theguardian.com/global-development/2019/dec/17/were-bonded-like-sisters-the-choir-giving-trafficked-women-a-voice-amies-freedom-choir,‘We're bonded like sisters': the choir giving trafficked women a voice,no,0.7216,0.1508
497,global-development/2019/jun/28/congo-abuses-drive-global-rise-in-sexual-violence-against-women,https://www.theguardian.com/global-development/2019/jun/28/congo-abuses-drive-global-rise-in-sexual-violence-against-women,Conflict drives global rise in sexual violence against women,no,0.538,0.5725
498,uk-news/davehillblog/2016/jul/15/97-lea-bridge-road-a-case-study-of-redevelopment-in-east-london,https://www.theguardian.com/uk-news/davehillblog/2016/jul/15/97-lea-bridge-road-a-case-study-of-redevelopment-in-east-london,97 Lea Bridge Road: a case study of redevelopment in east London,no,0.4334,0.2034
499,australia-news/2019/apr/01/intellectual-disability-advocates-50m-push-to-improve-medical-care,https://www.theguardian.com/australia-news/2019/apr/01/intellectual-disability-advocates-50m-push-to-improve-medical-care,Intellectual disability advocates' $50m push to improve medical care,no,0.3404,0.2637
500,australia-news/2018/may/24/king-island-birds-face-extinction-without-urgent-federal-help-residents-say,https://www.theguardian.com/australia-news/2018/may/24/king-island-birds-face-extinction-without-urgent-federal-help-residents-say,"King Island birds face extinction without urgent federal help, residents say",no,0.5657,0.3179
501,money/2019/may/27/number-of-over-70s-still-in-work-more-than-doubles-in-a-decade,https://www.theguardian.com/money/2019/may/27/number-of-over-70s-still-in-work-more-than-doubles-in-a-decade,Number of over-70s still in work more than doubles in a decade,no,0.5703,0.2651
502,world/2019/oct/12/alexandria-ocasio-cortez-haircut-uproar-aoc-reminder-women-cant-win-under-the-patriarchy,https://www.theguardian.com/world/2019/oct/12/alexandria-ocasio-cortez-haircut-uproar-aoc-reminder-women-cant-win-under-the-patriarchy,The uproar over AOC's hair is a reminder that women can't win under the patriarchy,no,0.2373,0.2759
503,world/2019/sep/06/hero-turned-tyrant-international-reaction-robert-mugabe-death,https://www.theguardian.com/world/2019/sep/06/hero-turned-tyrant-international-reaction-robert-mugabe-death,‘Hero turned tyrant’: international reaction to Mugabe’s death,no,0.5781,0.2021
504,australia-news/2019/may/01/doctor-who-called-for-women-to-be-raped-was-not-suspended-until-two-years-after-complaints,https://www.theguardian.com/australia-news/2019/may/01/doctor-who-called-for-women-to-be-raped-was-not-suspended-until-two-years-after-complaints,Doctor who called for women to be raped to be investigated over dozens more posts,no,0.5569,0.0484
505,education/2019/jun/05/schools-in-england-to-give-extra-lessons-on-dangers-of-knives,https://www.theguardian.com/education/2019/jun/05/schools-in-england-to-give-extra-lessons-on-dangers-of-knives,Schools in England to give extra lessons on dangers of knives,no,0.4293,0.21
506,money/2018/may/21/sell-home-raffle-beat-housing-market-losses,https://www.theguardian.com/money/2018/may/21/sell-home-raffle-beat-housing-market-losses,Selling your home by raffle could be a gamble,no,0.7218,0.2504
507,law/2019/jan/28/justice-ministry-knew-court-it-systems-were-obsolete-papers-reveal,https://www.theguardian.com/law/2019/jan/28/justice-ministry-knew-court-it-systems-were-obsolete-papers-reveal,"Justice ministry knew court IT systems were ‘obsolete’, papers reveal",no,0.4557,0.1766
508,uk-news/2019/aug/13/samuel-garside-residents-move-back-despite-fire-safety-fears,https://www.theguardian.com/uk-news/2019/aug/13/samuel-garside-residents-move-back-despite-fire-safety-fears,Barking fire: social tenants told to return despite safety fears,no,0.9477,0.0998
509,business/2018/sep/05/helena-morrissey,https://www.theguardian.com/business/2018/sep/05/helena-morrissey,Helena Morrissey: 'discussing radical proposals appealed',no,0.681,0.4216
510,politics/2019/oct/02/the-uk-is-not-the-us-trump-cards-wont-work-here,https://www.theguardian.com/politics/2019/oct/02/the-uk-is-not-the-us-trump-cards-wont-work-here,The UK is not the US – Trump cards won’t work here | Letters,no,0.4616,0.3466
511,australia-news/2018/jun/25/centrelink-automation-hurting-australias-most-vulnerable-anglicare,https://www.theguardian.com/australia-news/2018/jun/25/centrelink-automation-hurting-australias-most-vulnerable-anglicare,Centrelink automation hurting Australia's most vulnerable – Anglicare,no,0.5569,0.0913
512,world/2018/jul/22/german-leftwingers-woo-voters-with-national-social-stance,https://www.theguardian.com/world/2018/jul/22/german-leftwingers-woo-voters-with-national-social-stance,Germany's left and right vie to turn politics upside down,no,0.5334,0.188
513,society/2018/sep/05/four-million-uk-children-too-poor-to-have-a-healthy-diet-study-finds,https://www.theguardian.com/society/2018/sep/05/four-million-uk-children-too-poor-to-have-a-healthy-diet-study-finds,"Four million UK children too poor to have a healthy diet, study finds",no,0.4556,0.2674
514,world/2019/jun/29/greece-tourism-florida-of-europe,https://www.theguardian.com/world/2019/jun/29/greece-tourism-florida-of-europe,Greece sees its future as the Florida of Europe,no,0.3302,0.4225
515,education/2019/may/25/rise-in-special-needs-children-forced-to-attend-distant-schools,https://www.theguardian.com/education/2019/may/25/rise-in-special-needs-children-forced-to-attend-distant-schools,Rise in special needs pupils forced to attend out-of-area schools,no,0.6743,0.2366
516,society/2019/mar/28/nhs-trainee-doctors-denied-leave-dossier-hospitals,https://www.theguardian.com/society/2019/mar/28/nhs-trainee-doctors-denied-leave-dossier-hospitals,Dossier reveals 'petty tortures' of NHS trainee doctors denied leave,no,0.5932,0.3714
517,uk-news/2018/jan/30/skilled-migrants-protest-against-uk-visa-policies,https://www.theguardian.com/uk-news/2018/jan/30/skilled-migrants-protest-against-uk-visa-policies,Skilled migrants protest against UK visa policies,no,0.562,0.3328
518,world/2020/apr/20/nhs-frontline-meet-people-risking-lives-tackle-coronavirus,https://www.theguardian.com/world/2020/apr/20/nhs-frontline-meet-people-risking-lives-tackle-coronavirus,On the frontline: meet the NHS workers tackling coronavirus,no,0.6184,0.2911
519,society/2019/aug/02/healthy-social-life-could-ward-off-dementia-study-shows,https://www.theguardian.com/society/2019/aug/02/healthy-social-life-could-ward-off-dementia-study-shows,"Healthy social life could ward off dementia, study shows",no,0.505,0.3052
520,society/2018/jul/04/nhs-collapse-without-them-growing-role-volunteers,https://www.theguardian.com/society/2018/jul/04/nhs-collapse-without-them-growing-role-volunteers,'The NHS would collapse without them': the growing role of volunteers,no,0.5598,0.3714
521,australia-news/2019/jun/13/social-housing-landlords-use-domestic-violence-as-reason-to-evict-victims-study,https://www.theguardian.com/australia-news/2019/jun/13/social-housing-landlords-use-domestic-violence-as-reason-to-evict-victims-study,Social housing landlords use domestic violence as reason to evict victims – study,no,0.8346,0.3842
522,uk-news/2016/apr/01/national-living-wage-case-studies,https://www.theguardian.com/uk-news/2016/apr/01/national-living-wage-case-studies,National living wage case studies – the cleaner and the hotelier,no,0.7365,0.2881
523,media/2018/dec/11/guardians-amelia-gentleman-named-journalist-of-the-year,https://www.theguardian.com/media/2018/dec/11/guardians-amelia-gentleman-named-journalist-of-the-year,Guardian’s Amelia Gentleman named journalist of the year,no,0.6316,0.1069
524,environment/2019/nov/27/why-a-california-delicacy-wont-be-on-the-menu-this-thanksgiving,https://www.theguardian.com/environment/2019/nov/27/why-a-california-delicacy-wont-be-on-the-menu-this-thanksgiving,Why a California delicacy won't be on the menu this Thanksgiving,no,0.4335,0.3602
525,world/2020/mar/31/how-will-the-world-emerge-from-the-coronavirus-crisis,https://www.theguardian.com/world/2020/mar/31/how-will-the-world-emerge-from-the-coronavirus-crisis,‘We can’t go back to normal’: how will coronavirus change the world?,no,0.3146,0.1027
526,australia-news/2018/aug/02/queensland-green-light-sexual-violence-experts-say,https://www.theguardian.com/australia-news/2018/aug/02/queensland-green-light-sexual-violence-experts-say,"Queensland providing 'green light' to perpetrators of sexual violence, experts say",no,0.9353,0.5725
527,australia-news/2019/aug/31/australian-journalism-must-fight-for-its-future-o-because-the-times-could-not-be-more-serious,https://www.theguardian.com/australia-news/2019/aug/31/australian-journalism-must-fight-for-its-future-o-because-the-times-could-not-be-more-serious,The Coalition is calling for religious freedom – so why has it forsaken the media's? | Katharine Murphy,no,0.6367,0.1069
528,education/2019/jan/15/to-save-the-rainforest-we-need-to-work-with-the-palm-oil-industry,https://www.theguardian.com/education/2019/jan/15/to-save-the-rainforest-we-need-to-work-with-the-palm-oil-industry,"To save the rainforest, we need to work with the palm oil industry | Jennifer Lucey",no,0.4534,0.2752
529,australia-news/2018/may/15/damning-report-finds-ndis-complaints-ignored-for-months,https://www.theguardian.com/australia-news/2018/may/15/damning-report-finds-ndis-complaints-ignored-for-months,Damning report finds NDIS complaints ignored for months,no,0.6158,0.1707
530,uk-news/2019/mar/04/inquiry-examine-alleged-child-sexual-abuse-politicians-cyril-smith-peter-morrison,https://www.theguardian.com/uk-news/2019/mar/04/inquiry-examine-alleged-child-sexual-abuse-politicians-cyril-smith-peter-morrison,Child sexual abuse inquiry to assess merit of claims against politicians,no,0.3942,0.3531
531,money/2018/jul/02/norway-electric-cars-subsidies-fossil-fuel,https://www.theguardian.com/money/2018/jul/02/norway-electric-cars-subsidies-fossil-fuel,What’s put the spark in Norway’s electric car revolution?,no,0.6176,0.3007
532,uk-news/2017/nov/01/vulnerable-women-still-locked-up-in-yarls-wood-immigration-centre,https://www.theguardian.com/uk-news/2017/nov/01/vulnerable-women-still-locked-up-in-yarls-wood-immigration-centre,Vulnerable women ‘still locked up in Yarl's Wood immigration centre’,no,0.562,0.4136
533,australia-news/2019/aug/14/facebook-could-tackle-fake-news-but-chooses-not-to-regulator-says,https://www.theguardian.com/australia-news/2019/aug/14/facebook-could-tackle-fake-news-but-chooses-not-to-regulator-says,"Facebook could tackle fake news but chooses not to, regulator says",no,0.423,0.1638
534,uk-news/2018/jul/24/enforcement-alone-wont-stop-violent-crime,https://www.theguardian.com/uk-news/2018/jul/24/enforcement-alone-wont-stop-violent-crime,Enforcement alone won’t stop violent crime | Letters,no,0.469,0.4087
535,money/2019/may/11/mental-health-seeking-help-can-stop-the-spiral-of-debt,https://www.theguardian.com/money/2019/may/11/mental-health-seeking-help-can-stop-the-spiral-of-debt,Mental health: seeking help can stop the spiral of debt,no,0.4571,0.3285
536,australia-news/2018/aug/25/banking-inquiry-accuses-nab-and-cba-of-possible-criminal-offences,https://www.theguardian.com/australia-news/2018/aug/25/banking-inquiry-accuses-nab-and-cba-of-possible-criminal-offences,Banking inquiry accuses NAB and CBA of possible criminal offences,no,0.8417,0.2518
537,society/2019/sep/02/uk-training-record-number-of-mental-health-first-aiders,https://www.theguardian.com/society/2019/sep/02/uk-training-record-number-of-mental-health-first-aiders,UK training record number of mental health first aiders,no,0.4991,0.3714
538,australia-news/2018/apr/14/the-state-school-turning-lives-around-for-disadvantaged-children,https://www.theguardian.com/australia-news/2018/apr/14/the-state-school-turning-lives-around-for-disadvantaged-children,The state school turning lives around for disadvantaged children,no,0.2662,0.4561
539,world/2019/mar/05/kashmir-fog-of-war-how-conflicting-accounts-benefit-india-pakistan,https://www.theguardian.com/world/2019/mar/05/kashmir-fog-of-war-how-conflicting-accounts-benefit-india-pakistan,Kashmir's fog of war: how conflicting accounts benefit both sides,no,0.6139,0.1062
540,society/2019/aug/14/uk-holiday-hunger-schemes-deprived-children-summer,https://www.theguardian.com/society/2019/aug/14/uk-holiday-hunger-schemes-deprived-children-summer,‘Every day we see really hungry kids. They shouldn’t be living like this’ | Tom Wall,no,0.7125,0.2099
541,uk-news/2019/jan/15/west-midlands-police-failing-to-report-thousands-of-crimes,https://www.theguardian.com/uk-news/2019/jan/15/west-midlands-police-failing-to-report-thousands-of-crimes,West Midlands police 'failing to report thousands of crimes',no,0.844,0.5725
542,world/2018/oct/13/saudi-arabia-khashoggi-chulov,https://www.theguardian.com/world/2018/oct/13/saudi-arabia-khashoggi-chulov,Can Saudi Arabia's ‘great reformer’ survive the death in the consulate?,no,0.3614,0.1742
543,law/2019/jul/26/rape-cases-charge-summons-prosecutions-victims-england-wales,https://www.theguardian.com/law/2019/jul/26/rape-cases-charge-summons-prosecutions-victims-england-wales,"Just 1.5% of all rape cases lead to charge or summons, data reveals",no,0.7401,0.5725
544,environment/2019/mar/27/us-china-soy-tariff-war-could-destroy-13-million-hectares-of-amazon-rainforest,https://www.theguardian.com/environment/2019/mar/27/us-china-soy-tariff-war-could-destroy-13-million-hectares-of-amazon-rainforest,US-China soy trade war could destroy 13 million hectares of rainforest,no,0.5004,0.3358
545,environment/2018/jun/06/pumped-hydro-projects-unveiled-as-tasmania-bids-to-be-battery-of-the-nation,https://www.theguardian.com/environment/2018/jun/06/pumped-hydro-projects-unveiled-as-tasmania-bids-to-be-battery-of-the-nation,Pumped hydro projects unveiled as Tasmania bids to be 'battery of the nation',no,0.5217,0.5083
546,world/2018/jul/18/organ-donation-we-can-break-taboos-among-british-bame-communities,https://www.theguardian.com/world/2018/jul/18/organ-donation-we-can-break-taboos-among-british-bame-communities,Organ donation: we can break taboos among British BAME communities,no,0.5278,0.1007
547,world/2018/oct/13/melania-trump-claims-of-victimhood-have-a-hollow-ring-week-in-patriarchy,https://www.theguardian.com/world/2018/oct/13/melania-trump-claims-of-victimhood-have-a-hollow-ring-week-in-patriarchy,Melania Trump claims of victimhood have a hollow ring,no,0.2804,0.2759
548,environment/2019/apr/01/insects-have-no-place-to-hide-from-climate-change-study-warns,https://www.theguardian.com/environment/2019/apr/01/insects-have-no-place-to-hide-from-climate-change-study-warns,"Insects have ‘no place to hide’ from climate change, study warns",no,0.4004,0.3476
549,politics/2019/jul/26/finding-redemption-far-from-the-opera-of-boris-johnson-coronation,https://www.theguardian.com/politics/2019/jul/26/finding-redemption-far-from-the-opera-of-boris-johnson-coronation,Finding redemption far from the opera of Boris Johnson's coronation | John Crace,no,0.3857,0.1773
550,uk-news/2018/may/09/uk-accused-flouting-human-rights-racialised-war-gangs,https://www.theguardian.com/uk-news/2018/may/09/uk-accused-flouting-human-rights-racialised-war-gangs,UK accused of flouting human rights in 'racialised' war on gangs,no,0.7237,0.3725
551,technology/2018/aug/09/implanted-medical-devices-hacking-risks-medtronic,https://www.theguardian.com/technology/2018/aug/09/implanted-medical-devices-hacking-risks-medtronic,"Hackable implanted medical devices could cause deaths, researchers say",no,0.4959,0.185
552,world/2019/feb/21/germany-still-paying-pensions-to-wartime-nazi-collaborators,https://www.theguardian.com/world/2019/feb/21/germany-still-paying-pensions-to-wartime-nazi-collaborators,Germany paying pensions to Nazi collaborators in UK and Belgium,no,0.4116,0.1399
553,uk-news/2016/aug/13/council-planners-must-inspire-public-sector-development-in-brexit-aftermath,https://www.theguardian.com/uk-news/2016/aug/13/council-planners-must-inspire-public-sector-development-in-brexit-aftermath,Council planners must ‘inspire public sector development’ in Brexit aftermath,no,0.3162,0.1549
554,us-news/2018/sep/21/trump-administration-poses-new-threat-to-birds-in-allowing-incidental-killings,https://www.theguardian.com/us-news/2018/sep/21/trump-administration-poses-new-threat-to-birds-in-allowing-incidental-killings,Trump administration poses new threat to birds in allowing ‘incidental’ killings,no,0.438,0.3551
555,money/2019/feb/02/oldies-are-pampered-we-should-offer-a-new-deal-to-the-young,https://www.theguardian.com/money/2019/feb/02/oldies-are-pampered-we-should-offer-a-new-deal-to-the-young,Oldies are pampered. We should offer a new deal to the young | Patrick Collinson,no,0.7547,0.3411
556,global-development/2019/jan/31/damning-report-calls-on-uk-to-come-clean-over-arms-exports-yemen,https://www.theguardian.com/global-development/2019/jan/31/damning-report-calls-on-uk-to-come-clean-over-arms-exports-yemen,Damning Yemen report calls on UK to come clean over arms exports,no,0.8977,0.0969
557,business/2018/apr/23/legalising-cannabis-adds-36bn-to-australian-economy-budget-office-says,https://www.theguardian.com/business/2018/apr/23/legalising-cannabis-adds-36bn-to-australian-economy-budget-office-says,"Legalising cannabis adds $3.6bn to Australian economy, budget office says",no,0.3885,0.1578
558,australia-news/2017/feb/20/indigenous-incarceration-turning-the-tide-on-colonisations-cruel-third-act,https://www.theguardian.com/australia-news/2017/feb/20/indigenous-incarceration-turning-the-tide-on-colonisations-cruel-third-act,Indigenous incarceration: turning the tide on colonisation's cruel third act,no,0.5545,0.2645
559,technology/2017/jul/05/sex-robots-promise-revolutionary-service-but-also-risks-says-study,https://www.theguardian.com/technology/2017/jul/05/sex-robots-promise-revolutionary-service-but-also-risks-says-study,"Sex robots promise 'revolutionary' service but also risks, says study",no,0.3413,0.1657
560,society/2017/oct/26/thriving-work-report-uk-mental-health-problems-forcing-thousands-out,https://www.theguardian.com/society/2017/oct/26/thriving-work-report-uk-mental-health-problems-forcing-thousands-out,Mental health problems are forcing thousands in UK out of work – report,no,0.4409,0.3714
561,australia-news/2018/sep/22/morrison-is-a-leader-in-a-hurry-but-not-to-end-the-disgrace-of-nauru,https://www.theguardian.com/australia-news/2018/sep/22/morrison-is-a-leader-in-a-hurry-but-not-to-end-the-disgrace-of-nauru,Morrison is a leader in a hurry – but not to end the disgrace of Nauru | Katharine Murphy,no,0.3519,0.1506
562,society/2019/feb/07/the-class-pay-gap-why-it-pays-to-be-privileged,https://www.theguardian.com/society/2019/feb/07/the-class-pay-gap-why-it-pays-to-be-privileged,The class pay gap: why it pays to be privileged,no,0.4772,0.0721
563,education/2018/jun/30/coalition-education-reform-academies-fuelling-inequality,https://www.theguardian.com/education/2018/jun/30/coalition-education-reform-academies-fuelling-inequality,Coalition education reforms ‘fuelled inequality in schools’,no,0.6999,0.4561
564,society/2018/nov/21/scrap-juries-in-rape-trials-labour-mp-ann-coffey,https://www.theguardian.com/society/2018/nov/21/scrap-juries-in-rape-trials-labour-mp-ann-coffey,"Scrap juries in rape trials, Labour MP suggests",no,0.6799,0.5725
565,healthcare-network/2018/jan/08/mental-health-support-in-schools,https://www.theguardian.com/healthcare-network/2018/jan/08/mental-health-support-in-schools,Mental health support in schools: 'Families don’t have to spend years on waiting lists',no,0.7674,0.3731
566,society/2019/jan/07/learning-to-deal-with-mental-health-issues,https://www.theguardian.com/society/2019/jan/07/learning-to-deal-with-mental-health-issues,Learning to deal with mental health issues | Letters,no,0.6959,0.3731
567,australia-news/2018/jul/04/david-leyonhjelm-is-milking-this-moment-rallying-his-supporters-with-offence,https://www.theguardian.com/australia-news/2018/jul/04/david-leyonhjelm-is-milking-this-moment-rallying-his-supporters-with-offence,"David Leyonhjelm is milking this moment, rallying his supporters with offence | Katharine Murphy",no,0.439,0.1187
568,australia-news/2018/may/18/australias-cut-to-healthcare-on-manus-island-inexplicable-amnesty-says,https://www.theguardian.com/australia-news/2018/may/18/australias-cut-to-healthcare-on-manus-island-inexplicable-amnesty-says,"Australia's cut to healthcare on Manus Island 'inexplicable', Amnesty says",no,0.5026,0.1675
569,australia-news/2016/nov/21/one-nation-senator-shoots-down-labor-bid-to-amend-anti-union-bills,https://www.theguardian.com/australia-news/2016/nov/21/one-nation-senator-shoots-down-labor-bid-to-amend-anti-union-bills,Senate passes union regulator bill after Coalition whistleblower concession,no,0.3499,0.2645
570,society/2018/jan/19/people-with-mental-illnesses-refused-access-to-insurance-cover,https://www.theguardian.com/society/2018/jan/19/people-with-mental-illnesses-refused-access-to-insurance-cover,People with mental illnesses refused access to insurance cover,no,0.4538,0.2352
571,society/2018/apr/24/bill-should-cover-drunken-sexual-assault-of-emergency-workers,https://www.theguardian.com/society/2018/apr/24/bill-should-cover-drunken-sexual-assault-of-emergency-workers,Bill should cover drunken sexual assault of emergency workers | Letters,no,0.414,0.1302
572,society/2018/oct/09/mental-health-patients-waiting-nhs-treatment-delays,https://www.theguardian.com/society/2018/oct/09/mental-health-patients-waiting-nhs-treatment-delays,Delays in NHS mental health treatment 'ruining lives',no,0.9378,0.3714
573,politics/2018/jun/17/europeans-caring-for-british-relatives-fear-brexit-expulsion-settled-status-delay-home-office,https://www.theguardian.com/politics/2018/jun/17/europeans-caring-for-british-relatives-fear-brexit-expulsion-settled-status-delay-home-office,EU nationals fear Brexit will tear carers from their families,no,0.3577,0.0473
574,education/2018/oct/12/my-university-forced-me-into-teaching-training-it-was-all-dry-eduspeak,https://www.theguardian.com/education/2018/oct/12/my-university-forced-me-into-teaching-training-it-was-all-dry-eduspeak,My university forced me into teaching training. It was all dry 'eduspeak' | Anonymous academic,no,0.3791,0.4635
575,global-development/2018/jun/27/weapons-costing-lives-in-deadly-wars-abroad-are-also-costing-jobs-at-home,https://www.theguardian.com/global-development/2018/jun/27/weapons-costing-lives-in-deadly-wars-abroad-are-also-costing-jobs-at-home,The arms trade needs moral balance – lives and livelihoods depend on it | Rod Austin,no,0.2633,0.1059
576,science/political-science/2018/jul/12/its-time-to-burst-the-biomedical-bubble-in-uk-research,https://www.theguardian.com/science/political-science/2018/jul/12/its-time-to-burst-the-biomedical-bubble-in-uk-research,It’s time to burst the biomedical bubble in UK research,no,0.5104,0.054
577,global-development/2019/may/17/reef-wipeout-three-surfers-fight-china-linked-mega-resort-in-fiji,https://www.theguardian.com/global-development/2019/may/17/reef-wipeout-three-surfers-fight-china-linked-mega-resort-in-fiji,Reef wipeout: surfers fight China-linked mega resort in Fiji,no,0.3713,0.1165
578,education/2018/mar/31/schools-funding-crisis-swing-election-teachers-union-conference-neu-nasuwt,https://www.theguardian.com/education/2018/mar/31/schools-funding-crisis-swing-election-teachers-union-conference-neu-nasuwt,"Schools funding crisis could swing election, union conference told",no,0.6005,0.2436
579,public-leaders-network/2016/jul/26/public-service-failures-doncaster-rotherham-mid-staffs,https://www.theguardian.com/public-leaders-network/2016/jul/26/public-service-failures-doncaster-rotherham-mid-staffs,Has government learned the vital lessons of public service failures?,no,0.2631,0.1671
580,australia-news/2018/jul/25/guards-to-be-trained-in-asphyxiation-risks-after-david-dungay-death-in-custody,https://www.theguardian.com/australia-news/2018/jul/25/guards-to-be-trained-in-asphyxiation-risks-after-david-dungay-death-in-custody,Guards to receive urgent training in asphyxiation risks after David Dungay death in custody,no,0.3314,0.4136
581,world/2018/jun/20/coalition-launches-inquiry-into-sexual-harassment-over-metoo-revelations,https://www.theguardian.com/world/2018/jun/20/coalition-launches-inquiry-into-sexual-harassment-over-metoo-revelations,Coalition launches inquiry into sexual harassment over #MeToo revelations,no,0.4776,0.1227
582,society/2019/may/02/end-to-aids-in-sight-as-huge-study-finds-drugs-stop-hiv-transmission,https://www.theguardian.com/society/2019/may/02/end-to-aids-in-sight-as-huge-study-finds-drugs-stop-hiv-transmission,End to Aids in sight as huge study finds drugs stop HIV transmission,no,0.3853,0.3706
