title,url,body
UK health regulator rejects lecanemab as treatment for Alzheimer’s,https://www.theguardian.com/society/article/2024/aug/22/uk-health-regulator-rejects-lecanemab-as-treatment-for-alzheimers,"The UK’s health regulator has rejected a drug that can slow the progression of Alzheimer’s disease, saying its benefits are too small to justify the costs of the therapy and close monitoring of patients for signs of “serious side-effects”. Lecanemab, which is given twice a month, removes sticky clumps of protein amyloid beta from the brain, believed to be a hallmark of the disease. The drug is not a cure. But in clinical trials, the therapy slowed cognitive decline by 27% in early Alzheimer’s patients, compared with a placebo. The Medicines and Healthcare products Regulatory Agency (MHRA), the UK’s drugs regulator, gave the green light to the drug on Thursday. However, the National Institute for Health and Care Excellence (Nice), the health regulator, simultaneously ruled out offering the drug on the NHS. It comes weeks after the EU’s drugs regulator also rejected the drug, saying the risk of serious brain swelling did not outweigh its small impact on slowing cognitive decline. It also said the effects of the drug on delaying cognitive decline were small. The Nice decision is a further blow to the companies behind the drug, Eisai and Biogen, as the treatment faces slow take-up in the US, where it costs about £20,000 per patient per year. It also lays bare the complexities tied to a new class of drugs that have benefited early-stage patients, but can cause serious side-effects. The therapy, also known as Leqembi, is approved in the US, China, Hong Kong, Israel, Japan and South Korea. The green light from the MHRA means the UK has become the first country in Europe to license the drug that can treat the neurodegenerative condition rather than its symptoms. However, the rejection of its use on the NHS by Nice means probably only a small number of patients will benefit in the UK, and will have to access the drug privately. Hilary Evans-Newton, the chief executive of Alzheimer’s Research UK, said: “Today’s news is bittersweet for people affected by Alzheimer’s disease. “It’s a remarkable achievement that science is now delivering licensed treatments that can slow down the devastating effects of Alzheimer’s, rather than just alleviating its symptoms. However, it’s clear our health system isn’t ready to embrace this new wave of Alzheimer’s drugs. “It means that, as things stand, people in the early stages of the disease will be denied access to lecanemab through the NHS, and it will only be available to those who can pay privately.” Dr Samantha Roberts, the chief executive of Nice, said: “This is a new and emerging field of medicine which will no doubt develop rapidly. “However, the reality is that the benefits this first treatment provides are just too small to justify the significant cost to the NHS. “It is an intensive treatment to give to patients involving a hospital visit every two weeks with skilled staff needed to monitor them for signs of serious side-effects, plus the cost of purchasing the drug. “Our independent committee has rigorously evaluated the available evidence, including the benefit for carers, but Nice must only recommend treatments that offer good value to the taxpayer.” According to Nice, clinical trials showed lecanemab can slow cognitive decline by four to six months, but there was little evidence on its long-term effects. It estimates about 70,000 adults in England would have been eligible for treatment. A public consultation on Nice’s draft guidance will close on 20 September. Julian Beach, interim executive director for healthcare quality and access at MHRA, said: “Licensing medicines which meet acceptable standards of safety, quality and efficacy is a key priority for us. “We’re assured that, together with the conditions of the licence approval, the appropriate regulatory standards for this medicine have been met. “As with all medical products, we will keep its safety under close review, and with a controlled post-authorisation safety study to be undertaken, we will ensure that the benefit risk of lecanemab in clinical use is closely followed up.” Tara Spires-Jones, professor of the UK Dementia Research Institute at the University of Edinburgh, said the arrival of the drug marked “a turning point” but cautioned that it could be accompanied by “dangerous side-effects”. Speaking on Radio 4’s Today programme, she said: “It’s the first time we’ve actually been able to slow disease progression at all. So from that standpoint, it’s amazing. “However, the treatment’s not perfect. It only slows disease progression moderately, and it comes with dangerous side-effects, and people really do need to be monitored very carefully, and only certain people will be able to use the drug. So together, it’s great news, but we have to temper our enthusiasm.” Asked what the dangerous side-effects were, Spires-Jones said: “Some people who take this drug have brain swelling and bleeding and a few people have died from those side-effects.”"
We know how to reduce deforestation – so where's the money?,https://www.theguardian.com/global-development-professionals-network/2017/jul/28/we-know-how-to-cut-deforestation-we-just-havent-got-the-money-to-do-it,"For years some environmentalists and economists have argued that you could pay people to keep their forests standing, maintaining carbon sources and habitat for threatened species. Yet, the idea – known as payments for ecosystem services or PES – has faced critics, who argued it wouldn’t live up to the hype. A new study in Science this week may make them think twice. “We needed better evidence about how well this approach worked in order to know if we should be scaling it up or rethinking it,” said Seema Jayachandran, lead author and development economist with Northwestern University. To really test PES, Jayachandran and her team went to the Hoima and Kibaale districts of Uganda – where deforestation for charcoal production is rampant – and randomly sorted 121 villages into two categories: those that would be offered money for not cutting their trees and those who wouldn’t. In the former, the local NGO Chimpanzee Sanctuary and Wildlife Conservation Trust (CSWCT), offered a contract to pay local landowners 70,000 Ugandan shillings (about $2.80 in 2012, or about £2.10 today) per hectare of forest left uncut annually. Locals could join up or keep cutting while CSWCT would monitor the progress to make sure those who signed on were compliant. After two years, the team analysed progress. In villages where locals were paid to keep trees standing, the deforestation rate was 4.2%. While this was high, it was nowhere near the rate in those villages that weren’t paid, which saw 9.1% of forest cover destroyed in just two years. Compared to business-as-usual, the PES programme significantly slowed forest loss. The result was even more impressive given that only about a third of locals approached by CSWCT signed on. “I’m not surprised that the programme reduced deforestation, but I am very surprised by how big the impact was,” said Jayachandran. She expected that the team might find that less deforestation in the selected villages would lead to more deforestation in outlying areas, an economic problem known as “leakage”. But satellite imagery showed no evidence of this. It is not the first time payments have been made to keep forests from being cut down – it has been done in Costa Rica and Mexico – but it is the first time researchers have set up a real-time field experiment, including a control group to tell them how the programme worked versus deforestation-as-usual. “Evidence from this gold-standard randomised controlled trial corroborates other evidence,” said Jonah Busch, a senior fellow at the Center for Global Development who was not involved in the research, adding that “paying people to keep forests standing can be a cost-effective way to reduce deforestation and thus fight climate change.” The researchers found that their approach was highly cost-effective. It cost them just $2.60 to avoid a metric ton of CO2 in the atmosphere. The current price of a ton of CO2 on the market is €5.12 ($6.05), but the estimated social cost is much higher: the US Environmental Protection Agency in 2012 estimated that a ton of CO2 kept out of the atmosphere was worth $39 – 15 times higher than paying Ugandans not to cut down their forest. While the study – and the media coverage – has focused on the carbon benefits, standing forests also provide habitat for species. In an age of potential mass extinction, recently described as “biological annihilation” by researchers in a controversial paper, this is arguably just as important. “The Ugandan government’s motivation for wanting to protect the forest was really biodiversity,” Jayachandran said. The villages are situated in a biological hotspot, home to 13 species of primates, including the eastern chimpanzee which is considered endangered due to deforestation, hunting and rampant snaring that has left a generation of chimp amputees. Jayachandran said she “hopes” that their study “would inspire others working on conservation to evaluate their programmes’ impacts through ‘field experiment’.” Many of the ideas under the new conservation philosophy banner – such as PES – have not been rigorously tested, despite being implemented by many of the world’s largest conservation groups. Unfortunately, the funding for the Uganda initiative has run out, but Jayachandran hopes that its success will convince funders to kick-start it again with CSWCT – and expand it. Busch said the “missing piece” in combating global deforestation is not good ideas, but funding from wealthy countries."
Conflict resolution programme 'improves wellbeing of pupils',https://www.theguardian.com/education/2018/nov/22/conflict-resolution-programme-improves-wellbeing-of-pupils,"Schools can significantly reduce the impact of bullying and improve pupils’ wellbeing by using a specialised system of conflict resolution and training, according to a ground-breaking study published in the Lancet. The research, led by the London School of Hygiene and Tropical Medicine and University College London, was conducted over three years in state schools in the south of England, and is the first of its type to study the use of “restorative practice” within schools, bringing together victims and perpetrators of damaging behaviour. The academics who wrote the Lancet study, including Prof Russell Viner, the president of the Royal College of Paediatrics and Child Health, concluded that the £58 cost per pupil to run the programme was likely to achieve “significant impacts” in improving child health and mental wellbeing. “The message from this is that how we organise our schools to promote students’ welfare should be a key part of any response to concerns about children’s mental health,” said Viner, professor in adolescent health at UCL. “None of this was meant to be just about bullying – it was about informing and involving pupils in their school’s behaviour policies, and the use of restorative practices to resolve difficult behaviour.” The programme, Learning Together, saw staff in 20 secondary schools trained in techniques of restorative practice, such as using respectful language to promote good behaviour. It also used student surveys and meetings to inform school policies, as well up to 10 hours a year of specialised classroom lessons on social and emotional skills. The trial followed nearly 6,000 pupils from the age of 11, and found that children in those schools reported less smoking, drinking and use of illegal drugs than their peers in the control group of schools, which did not benefit from the programme. By the third year, the researchers found small but significant reductions in incidents of bullying, as well as improved mental health. While the programme did not affect levels of aggression, it did have a greater impact on boys, and on students who had been victims of bullying. The study was given a guarded welcome by Tom Bennett, a teacher and the Department for Education’s independent adviser on behaviour in schools. “It’s certainly true that schools with effective policies for behaviour frequently insist that students have opportunities to realise the impact of their actions, and to formally discuss what good behaviour would look like and how they can improve. And this study does seem to offer some small glimmer that the tested strategies might be useful,” Bennett said. “But with the very small impact on bullying, and the fact that the impact on bullying was self-reported, it’s hard to say if actual bullying went down, or if surveyed students felt like it had. That might conceal more than it reveals, and that could be very significant.” Prof Chris Bonell of LSHTM, the lead author of the Lancet article, said the next step was to refine the programme and make it available to more schools. “This study suggests that restorative practice is an effective way to reduce bullying. It also suggests that the government could save the NHS money by helping ensure schools are inclusive and supportive places,” Bonell said. The randomised controlled trial was funded by the NHS’s National Institute for Health Research and the Education Endowment Foundation."
‘Very disappointing’: study shows education does nothing to stop homophobic language in men’s rugby,https://www.theguardian.com/sport/2023/feb/11/very-disappointing-study-shows-education-does-nothing-to-stop-homophobic-language-in-mens-rugby,"A landmark study on the use of homophobic language in men’s community sport has found education campaigns run by professional rugby players did nothing to stop young players and their coaches from mindlessly using words such as “fag” and “poof” in team settings. The results from Monash University, just published in the British Journal of Sports Medicine, directly contradict broadly accepted recommendations that this type of behaviour can be reduced through the formal delivery of education via videos or in-person talks – a practice used regularly in different sports around the world. They have also prompted Australian rugby officials and players to call for more resources to further address a “sport-wide” problem that is harming LGBTQ+ youth in numerous codes. Monash University had initially set out to conduct a multi-sport study, however found Rugby Victoria to be the most willing and quantitatively appropriate for the randomised controlled trial – the first to look at anti-homophobia educational intervention delivered by professional athletes. It was undertaken by every under-18s and Colts (under-20s) team in Victoria, whose participants filled out surveys two weeks before and two weeks after players from the Melbourne Rebels Super Rugby team travelled around the state to deliver talks. In the pre-training survey, 55.3% self-reported using homophobic language at least once over the previous two weeks and 77.4% perceived teammates to have used homophobic language. In the post-training survey, those numbers had risen to 61.2% and 82.1% respectively. “Use of professional rugby athletes to deliver education on homophobic language was not effective,” the study reads. “Other approaches to reduce homophobic language [and other forms of discrimination] such as peer-to-peer education, and enforcement of policies prohibiting specific language by coaches, should be explored.” The results do indicate that homophobia is not the primary driver behind the use of slurs, rather a means “to conform to the behavioural norms in rugby”. Dr Erik Denison, lead author on the paper titled ‘Effectiveness of an educational intervention targeting homophobic language use by young male athletes: a cluster randomised controlled trial’, said the results were “very disappointing”. “The results are also hard to understand because most young men we study, including the rugby players, have positive attitudes towards gay people and would have no problem with having a gay player on their team,” Denison said. “The vast majority also said they would stop others from bullying a gay teammate. Even more surprising, more than half said they have close gay friends. Despite all this, they are still using homophobic language, even after being told by professional rugby players that their behaviour is very harmful and to stop. “We aren’t just talking about them using phrases like ‘that’s gay’. They are constantly using words like ‘faggot’. This language is deeply entrenched in male sport and it will be very difficult to stop. “Boys report hearing their coaches and PE teachers using homophobic language as early as eight years old, and it seems they start using this language to conform to these older men and gain acceptance. This is how it remains so normalised in men’s sport.” Rugby Victoria president, Neil Hay, who was heavily involved in the study, did not believe it showed rugby was “in any way unique”. “It’s really true, from my experience of sports, that it’s a sport-wide thing,” Hay said. “It’s just that we were willing to stick our hand up and say ‘come and look at us’.” Hay, who also spent several years coaching Victoria’s gay and inclusive rugby club, the Melbourne Chargers, foreshadowed further work with Monash University including targeted training of coaches, who “appear to be major influencers on this”. “Because I think one of the things the study shows is that the vast majority of the language used, which is hurtful, is not done intentionally to hurt,” he said. “It’s to feel part of a bigger tribe group. And if it’s used by your leaders, then it’s going be accepted and acceptable, which isn’t accepted or acceptable to us as a governing body. “We will make sure they understand it isn’t acceptable, and that sort of language doesn’t give you camaraderie – there are many better ways and options to do that. “But how do we get into all the schools? How do we do diversity and inclusion? How do we do things on homophobic language if we don’t get assistance and help? How do we get the experts we can’t employ?” Lachlan Mitchell, a Rebels foundation player who was among those to join then-captain Tom English in delivering the training, also felt the findings were “probably more symptomatic of society rather than a reflection of that sport”. “The positive message for me was that there’s some learnings from that,” Mitchell said. “It’s a complex thing, so it’s not just a matter of athletes going and speaking to people, it’s got to be reinforced by everyone at all levels. “When I think about that from a grassroots club’s perspective, it’s not necessarily a club’s key priority at any given time. Even though they opened their doors for us to be involved, grassroots clubs are struggling just to survive – getting volunteers and funding – that probably needs to be taken into account as well.”"
Community workers help to bridge treatment gap in mental health | Rosalind Miller,https://www.theguardian.com/global-development/poverty-matters/2012/feb/16/lay-workers-mental-health-care,"A report in the Lancet last year concluded that improving access to effective mental healthcare could help to alleviate poverty. Mental health was framed as a ""development priority"". But access to that crucial healthcare remains a barrier to many people in poor countries. While in Europe a third of people experiencing mental illness do not receive treatment, in developing countries the situation is much worse. In some countries, basic care eludes nine out of 10 people in need. However, the largest psychiatry trial to be conducted in the developing world, the Manas intervention, convincingly demonstrated that training lay people can play a crucial role in helping to deliver effective care for depression and anxiety in resource-poor, primary healthcare settings. Community healthcare programmes are not uncommon, and the Manas trial applied similar principles – training people to deliver basic care in their own communities – to mental health. The randomised controlled trial was conducted in Goa, India, and involved more than 2,700 participants. After community consultation about the programme (which led to some changes in how the subject was addressed – for example, depression is explained as a stress-related illness), local people, mostly women, attended four-week training sessions on helping to manage depression, with an additional two weeks to cover specific disorders such as alcohol abuse. Typically, they are female university graduates, although it is envisaged that community members with a lower educational attainment will be used if the programme is scaled up. On completing training, the community worker is based within the primary health centre and works alongside a primary care doctor, under the supervision of a psychiatrist. There are only 4,000 psychiatrists in India, serving a population of 1.3 billion. Shifting certain aspects of care to non-specialists allows specialists to achieve greater coverage of the population. Primary health centres are also easily accessible and are a far cry from the old psychiatric institutions that are heavily imbued with stigma. Professor Vikram Patel, clinical psychiatrist and former Rhodes scholar, set up the trial, which found that patients receiving care experienced a 30% decrease in common mental disorders and were less likely to attempt suicide. There was also a substantial reduction in the number of days out of work due to illness. Patel insists armies of mental health professionals are not needed to provide care. Instead, he believes in ""mental health for all, by all"". ""We need to empower everyone to be able to understand the commonsense ways in which first they can promote their own mental health, 'mental health literacy',"" he says. ""Secondly, to provide mental healthcare when someone close to them is in a crisis, 'mental health first aid', and thirdly, at the professionalised level, to use lay health workers to provide mental care for people with mental illness. ""In many parts of the world chaining of people with mental illnesses is not uncommon, nor is seeing people walking around in clearly an unwell state, half naked, and no one takes any notice of them. It is tragic. There is a basic human right, which is not about just healthcare, but it is about the right to life with dignity, a right to citizenship."" However, there are several difficulties that need to be overcome if the intervention is to be extended to communities across the country. The support of specialists is essential, but many are sceptical about devolving responsibility to lay people. Many specialists prefer to work in the private sector, which means appropriate incentive packages will be required to encourage participation. The uneven distribution of specialists across the country must also be addressed. And, while the intervention tackles the supply side of the healthcare equation, a greater challenge will be creating a demand for the service. Patel remains optimistic. ""You address demand first of all by demonstrating that you can make a difference to people's lives when they suffer from these conditions. In any community, if you are able to demonstrate impact on individuals, the word gets around. 'That son that used to be tied up to the bed, today is working in the fields.' That is powerful stuff."""
