title,url,body
Labor pledges to transform policy-making by creating evaluator general,https://www.theguardian.com/australia-news/2018/nov/13/labor-pledges-to-transform-policy-making-by-creating-evaluator-general,"If your child is struggling to read, would you consider enrolling them in weekly reading sessions at your local library with trained instructors? Well, according to a randomised trial in England, that type of program has already been tried and it produced zero improvement in literacy skills. Labor is pledging to transform Canberra’s policy-making by introducing similar high-quality evaluations of commonwealth government programs to ensure taxpayers stop funding initiatives that aren’t working. The shadow assistant treasurer, Andrew Leigh, says if Labor wins the election it will create an “Office of the Evaluator General”, to be based within Treasury, to conduct rigorous evaluations of government programs. These would preferably be randomised trials whereby one group is exposed to the new program and another sticks with the existing policy. The evaluator general will be funded with $5m per year, starting in 2019-20. “Increasingly, policymakers in other nations are testing programs through randomised trials, with the same kind of control group used to evaluate new pharmaceuticals in clinical drug trials,” Leigh says. “When Australian policymakers develop programs in early childhood, health, crime and employment, we often look to those overseas randomised trials. “But while there have been a handful of local randomised policy trials – such as Victoria’s Journey to Social Inclusion experiment and the Early Years Education Program – relatively few Australian policies are subjected to rigorous evaluation. “The Auditor General, the Productivity Commission, the Australian Institute of Health and Welfare, the former Coag Reform Council and the Grattan Institute have all called for better evaluation of Australian government programs. The test-learn-adapt approach is vital to making progress on major challenges such as wage inequality, social mobility and Closing the Gap.” Leigh will announce the plan in a speech to the Australian National University on Tuesday. He will tell the audience at the ANU that half of Australia’s politicians and one-third of British politicians worry that randomised trials are unfair because voters are chosen at random to receive a new policy intervention – but rejecting randomised trials on the grounds of unfairness seems at odds with the fact that that is exactly what already happens with “pilot studies”. Leigh has credited the work of economist Dr Nicholas Gruen who has explained the value in creating an institution which could develop true expertise in evaluation. “As Australia faces challenges such as inequality, climate change and indigenous disadvantage, it’s time we raised the evidence bar,” Leigh says in speaking notes seen by Guardian Australia. “At a time when government budgets are under pressure, there’s no excuse for continuing to fund programs that don’t work.” The evaluator general will collaborate with existing evaluation bodies such as the Office of Development Effectiveness inside the department of foreign affairs and trade. It will also work with the Evidence Institute for Schools, a body Labor has promised to create within the department of education and training."
Labor launches new body to evaluate public programs using randomised trials,https://www.theguardian.com/australia-news/2023/aug/29/labor-australian-centre-for-evaluation,"Mimicking the way pharmaceutical companies use data to develop new drugs could help save the federal government millions of dollars while also making spending fairer, according to the assistant Treasury minister. Andrew Leigh will use a National Press Club speech on Tuesday to help launch the Australian Centre for Evaluation (ACE), a body funded in the May 2023 budget with an initial $10m over four years to design better policies. “If it was easy to close life expectancy gaps, educational gaps or employment gaps, then past generations would have done it already,” he will say, according to a copy of his speech. “The fact that these challenges persist means that good intentions aren’t enough.” Scientists have long deployed randomised trials to test results of a treatment against a control group. For instance, almost 275 years ago, the Scottish physician James Lind used oranges and lemons against cider and even sea water to prove the benefits of providing sailors with citrus to fight scurvy. Sign up for Guardian Australia’s free morning and afternoon email newsletters for your daily news roundup “In the decades since randomised trials became broadly accepted as the best way of evaluating medical treatments, millions of lives have been saved,” Leigh said. “That isn’t because every treatment that has emerged from the laboratory has worked. It’s because medicine has subjected those treatments to rigorous evaluation.” Leigh said the commonwealth alone spent at least $52m in 2021-22 on external consultants to evaluate programs’ effectiveness. Costly pilot studies, for example, can be avoided with the use of small control groups or analysis of existing data already on hand. The 2019 Thodey review found the Australian Public Service’s approach to program evaluation to be “piecemeal in both scope and quality, and that this diminishes accountability and is a significant barrier to evidence-based policymaking”. Leigh said the centre with its 14 staff would work with other departments to set priorities. “Early indications are that there’s strong enthusiasm from a number of agencies, including employment,” he told Guardian Australia. “We’re keen to work with states and territories, which was part of the thinking behind the name,” and even extend to non-government groups, Leigh said. He was also “keen for ACE to grow”, provided it met its own evaluation criteria. “The first test will be that ACE is doing rigorous evaluations, including randomised trials,” he said. “The second test will be that evaluation findings are being reflected in government policy, with ineffective programs being adjusted or ended and effective ones being scaled up.” Leigh said better evaluation wouldn’t merely improve governments’ productivity, it would also “create a more equal nation”. “When government fails, the most affluent have private options – private transport, private education, private healthcare, and private security,” he will say in his speech. “It’s the poorest who rely most on government, and the most vulnerable who stand to gain when government works better. Disadvantaged Australians don’t need ideology, they need practical solutions that improve their lives.”"
UK regulator approves Pfizer Covid vaccine for 12- to 15-year-olds,https://www.theguardian.com/world/2021/jun/04/uk-regulator-approves-pfizer-covid-vaccine-for-12-to-15-year-olds,"The UK regulator has approved the use of the Pfizer/BioNTech Covid vaccine in children aged 12 to 15, potentially opening the way for a vaccination campaign in schoolchildren. The decision on giving the vaccine to children rests with the government’s advisory body, the Joint Committee on Vaccination and Immunisation (JCVI), who will now look at the evidence. Children are generally less severely affected by Covid than adults, apart from a small minority who have suffered a debilitating condition as a result of infection called multisystem inflammatory syndrome. Most recover, although there appear to be some lingering longer-term effects, and a few have died. Mass immunisation of children, however, would help protect the adult population and particularly grandparents and other older relatives, who are especially vulnerable. That is also the rationale behind flu vaccination for young children. The Medicines and Healthcare products Regulatory Authority (MHRA) and the independent Commission on Human Medicines (CHM) said they had weighed the evidence of trials in children and believe the Pfizer vaccine is safe and effective. It has already been approved for use in children aged 12 to 15 in the US. “We have carefully reviewed clinical trial data in children aged 12 to 15 years and have concluded that the Pfizer/BioNTech Covid-19 vaccine is safe and effective in this age group and that the benefits of this vaccine outweigh any risk,” said Dr June Raine, the MHRA chief executive. “We have in place a comprehensive safety surveillance strategy for monitoring the safety of all UK-approved Covid-19 vaccines and this surveillance will include the 12- to 15-year age group. “No extension to an authorisation would be approved unless the expected standards of safety, quality and effectiveness have been met. “It will now be for the Joint Committee on Vaccination and Immunisation to advise on whether this age group will be vaccinated as part of the deployment programme.” Both Pfizer and Moderna, which make similar vaccines, have reported 100% efficacy in the age group – meaning none of the children in the trials developed Covid symptoms. AstraZeneca has begun trials in younger children and aims to enrol 300 volunteers aged six to 18 across four sites in London, Oxford, Bristol and Southampton. Prof Sir Munir Pirmohamed, the chair of the CHM, said it had looked carefully for any potential risk of side-effects. “There has been a thorough assessment and review of this data which was also looked at specifically by the CHM’s paediatric medicines expert advisory group who are scientific experts within this age group, as well as the CHM’s Covid-19 vaccines benefit risk expert working group,” he said. “We have concluded that based on the data we have seen on the quality, effectiveness and safety of the vaccine, its benefits do outweigh any risk. The MHRA will continue to scrutinise all of the suspected side-effects data received through the rigorous surveillance programme in place through the yellow card scheme and other safety surveillance measures for all of the Covid-19 vaccines used in the UK. “Over 2,000 children aged 12 to 15 years were studied as part of the randomised, placebo-controlled clinical trials. There were no cases of Covid-19 from seven days after the second dose in the vaccinated group, compared with 16 cases in the placebo group. In addition, data on neutralising antibodies showed the vaccine working at the same level as seen in adults aged 16 to 25 years. These are extremely positive results.”"
UK medicines regulator approves Pfizer’s ‘life-saving’ Covid pill,https://www.theguardian.com/world/2021/dec/31/uk-medicines-regulator-approves-pfizers-life-saving-covid-pill-paxlovid,"UK regulators have approved Pfizer’s “life-saving” antiviral drug Paxlovid, which boasts nearly 90% success in preventing severe illness among vulnerable adults if taken soon after becoming infected with Covid-19. The Medicines and Healthcare products Regulatory Agency (MHRA) found the oral treatment “to be safe and effective at reducing the risk of hospitalisation and death in people with mild to moderate Covid-19 infection, who are at an increased risk of developing severe disease”. The agency said Paxlovid was most effective when taken during the early stages of a Covid infection, and recommended it was used within five days of a patient’s first symptoms. The approval is for patients aged 18 and over with at least one risk factor for developing severe illness, such as obesity or diabetes, or being over 60. Dr June Raine, the MHRA’s chief executive, said: “We now have a further antiviral medicine for the treatment of Covid-19 that can be taken by mouth rather than administered intravenously. This means it can be administered outside a hospital setting, before Covid-19 has progressed to a severe stage. “I hope the announcement gives reassurance to those particularly vulnerable to Covid-19, for whom this treatment has been approved. For these individuals, this treatment could be life-saving.” Before Christmas Pfizer said the UK government had agreed to purchase 2.5m courses of Paxlovid after an earlier purchase of 250,000 doses, conditional on regulatory approval. The MHRA noted that Paxlovid was “not a substitute for vaccination”, and said vaccines and boosters remained the best way to avoid being hospitalised because of Covid. Pfizer has said the drug showed near 90% efficacy in preventing hospitalisations and deaths in high-risk patients, with recent data suggesting the pill was also effective against the Omicron variant. In a clinical trial involving high-risk adults with Covid, Paxlovid reduced the rate of severe illness by 89% compared with a placebo group. Just three out of 389 patients were hospitalised or died from Covid-19 after taking the drug within three days of symptoms, compared with 27 out of 385 in the placebo group. Scientists said Paxlovid worked through protease inhibitors, which prevent a virus from replicating. These were similar to those used to treat HIV, making it beneficial for patients with weak immune systems. The two parts of Paxlovid, nirmatrelvir (PF-07321332) and ritonavir, are taken together, twice a day for five days. PF-07321332 is a new antiviral, while ritonavir – which slows the breakdown of PF-07321332 within the liver to increase its effectiveness – is already used alongside HIV medications. However, ritonavir can interfere with the functioning of other drugs through the liver, meaning Paxlovid may not be offered if patients cannot pause existing courses of medication. Prof Munir Pirmohamed, the chair of the MHRA’s commission on human medicines, said its coronavirus expert working group had endorsed the agency’s approval of Paxlovid, calling it “another safe and effective treatment” against Covid-19. “As it is deployed, we will monitor its effectiveness and safety in the real world, including any drug interactions, as we do with all medicines,” he said. The MHRA has already approved an antiviral pill, molnupiravir, made by Merck. But its results have been disappointing and it may be only about 30% effective in preventing hospitalisation. There have also been concerns raised over molnupiravir’s potential to lead to further variants."
Recommendation paves way for FDA authorization of Moderna Covid vaccine in US,https://www.theguardian.com/world/2020/dec/17/moderna-vaccine-coronavirus-covid-fda-recommendation-approval,"An advisory committee for the US Food and Drug Administration (FDA) has recommended the agency authorize a second Covid-19 vaccine, this one developed by Moderna and the National Institute of Allergy and Infectious Diseases (NIAID). The recommendation paves the way for the FDA to give emergency approval for a second highly effective vaccine to be used in the US. That approval could come by the end of the week. An FDA analysis found Moderna’s vaccine is more than 94% effective at preventing Covid-19 in a trial of more than 30,000 participants. The likely authorization of the second vaccine comes after more than 300,000 Americans have succumbed to Covid-19, in a winter-time “third wave” of the disease that is filling hospitals with patients and exhausting healthcare workers. The recommendation comes from the FDA’s Center for Biologics and Evaluation and Research vaccine advisory committee, an independent panel of experts who last week recommended the agency authorize a vaccine developed by Pfizer/BioNTech. “The question is never when do you know everything, it’s when do you know enough,” said Dr Paul Offit, a vaccine and infectious disease expert at the Children’s Hospital of Philadelphia. The answer to whether the advisory committee should recommend emergency authorization of the vaccine is, “Clearly, yes.” “We’re talking about a pandemic in which we really need to move this forward,” said Dr Steven Pergam, another board member and an infectious disease expert at Seattle Cancer Care Alliance. The Pfizer vaccine became the first drug authorized by the FDA to prevent Covid-19 in the US. It was earlier authorized by the UK and Canada. While the FDA does not always take the advice of its expert committees, the agency is expected to swiftly authorize the Moderna vaccine for emergency use. Like Pfizer’s vaccine, the drug developed by Moderna to prevent Covid-19 uses messenger RNA technology. This technology introduces the body to the spike protein coating the surface of the coronavirus. The vaccine was developed in a joint effort by Moderna Inc and NIAID. It received nearly $2.5bn in US government funding, and the federal government has already purchased 200m doses with an option to buy 300m more. Emergency approval of a second vaccine would put the US on track to potentially immunize up to 150 million people between now and mid-2021, if the government can effectively roll out the most logistically challenging public health campaign in history. Both vaccines require two dose “booster” regimens. About 6m doses are expected to begin being distributed immediately after FDA emergency authorization. The federal government will pay for both vaccines, with no out-of-pocket costs to Americans. Notably, the hearing for the second potential vaccine included doctors who spoke about the impact Covid-19 has had on themselves and their staff. “There’s a real price to be paid for getting Covid,” said Dr. Douglas Dieterich, a professor of medicine at Mount Sinai’s institute of liver diseases who was infected with Covid-19, and lost his sense of smell, and feeling in his feet, among other long-term side effects. “I think the vaccine is the answer to prevent Covid-19,” he said. Dr. Donald Middleton, a doctor at the University of Pittsburgh Medical Center, said one of his residents was about to sedate an intubated 70-year-old Covid-19 patient, when she wrote him a note. “I love y’all, my life is in y’all’s hands,” the patient wrote. “Even though their staff does their duty daily, they are in hell,” said Middletown. “Please advise the FDA to give this outstanding vaccine full [emergency authorization] status.” The second US authorization comes as the FDA is updating guidance given to doctors after a health worker in Alaska experienced an allergic reaction immediately after receiving the vaccine. Moderna’s scientists said there were two allergic reactions in its trial, one in the placebo arm and another in a vaccine recipient. In the vaccine arm, the allergic reaction was more than 60 days after the participant received the vaccine, and was found to be related to a separate medical procedure. The second approval also poses a substantial challenge to vaccine researchers, who are now “experiencing significant drop-out” in the blinded, placebo-controlled trial as vaccines become available, said Dr. Lindsey R Baden, one of three co-principal investigators and a doctor at Brigham and Women’s Hospital in Massachusetts. That means observational data, considered lower quality, will need to be carefully analyzed to learn more about the vaccine as it is distributed. Even with this second approval, the US would still need to authorize more vaccines in order to vaccinate the majority of Americans. Moderna’s vaccine, like Pfizer’s, would be authorized for emergency use with the idea that the company would apply for a full approval in coming months. Importantly, Moderna’s vaccine holds two distinct advantages over Pfizer’s. First, it does not require ultra-cold storage. That means the vaccine could be less susceptible to wastage and will be easier to transport to rural communities. It also does not require dilution or mixing, like Pfizer’s vaccine. The second advantage is more subtle – Moderna’s Phase III clinical trial data showed no members of the vaccinated group developed severe Covid-19, where 30 placebo group members did. This means for the 6% of people who do not receive the preventive effects of the vaccine, the vaccine may still reduce severity of symptoms. The Pfizer vaccine is authorized in children as young as 16, but Moderna’s vaccine can only be used in adults 18 and older. That could leave roughly a quarter of the population vulnerable to infection by the coronavirus, and increase the need to universally vaccinate adults."
Covid vaccine provisionally approved in Australia for children aged six months to six years,https://www.theguardian.com/australia-news/2022/jul/19/covid-vaccine-provisionally-approved-in-australia-for-children-aged-six-months-to-six-years,"Children aged from six months up to six years may soon be eligible for Covid-19 vaccination, after Australia’s drugs regulator approved a paediatric dose of the Moderna vaccine. The vaccine is already approved for children aged six years and older, who can receive two doses administered at least 28 days apart, and it is also used as a booster dose for adults aged 18 years and older. Currently there is no Covid-19 vaccination available to younger age groups. In a statement the Therapeutic Goods Administration (TGA) said: “As we have seen with children in older age groups, the TGA expects that vaccines for younger children will provide protection from the most severe outcomes of Covid-19, such as hospitalisation and death.” For children aged six months to six years, the vaccine is administered as two doses at least 28 days apart. The paediatric vaccine is made in the same way as the vaccines for older people but contains a lower concentration of the active ingredient. The vaccine was given “provisional approval” by the TGA on Thursday, which means Moderna must continue providing information to the TGA on longer-term efficacy and safety from ongoing clinical trials and post-market assessment. This is the same as for other available vaccines. Before the vaccine for those aged six months to six years is incorporated as part of the national Covid-19 vaccine program, the Australian Technical Advisory Group on Immunisation (Atagi) needs to also consider the safety and efficacy data provided to the TGA, along with epidemiological data and broader international evidence. Atagi will also consider current Covid-19 outbreaks, infections and vaccination rates in making its determination. It will then make recommendations about if, how and in what circumstances the vaccine should be rolled out to this age group. The TGA said Atagi would provide this advice to government “in the coming weeks”. The federal health minister, Mark Butler, said on Thursday that at the moment there is a very “limited global supply” of the child vaccine. Until Atagi makes its recommendations and supply is secured, the vaccine will not yet be available to young children. “I want to stress very strongly that this is just the first step in a process,” Butler said. “Having been approved provisionally by the TGA, this vaccine now needs to go to the technical advisory group on immunisations … until that point, this is simply not a vaccine that would be available to those children. Also, if Atagi does approve that vaccine to children of that group, or a cohort within that age group, then supply of that vaccine also needs still to be arranged.” In the meantime, parents of those children should take their children for their flu shot, he said. However the prime minister, Anthony Albanese, seemed optimistic the vaccine would be given Atagi clearance for rollout and that supply would be assured, writing in a post on Instagram; “stay tuned in the coming weeks for more information about how and when to get your children immunised against Covid”. He added the health department was already procuring the vaccines “so they will be ready to go when our experts give the go-ahead”. In making its decision, the TGA considered data from the KidCOVE clinical trial in Canada and the United States. The study included more than 6,000 participants aged from six months up to six years. “The study demonstrated that the immune response to the vaccine in children was similar to that seen in young adults [18 to 25 years] with a favourable safety profile,” the TGA said. “Clinical trials also showed that the safety profile in children is similar to that seen in adults. Most adverse events seen in clinical trials in children aged six months up to six years were mild-moderate and generally reported after the second dose.” A consultant paediatrician and medical lead of the Melbourne Vaccine Education Centre, Dr Daryl Cheng, said expansion of Covid-19 vaccines to young children would be “a welcome relief for many concerned parents and families”. “Whilst children are less likely to have severe outcomes or complications from Covid-19 compared with adults, they continue to experience high levels of infection, which disrupts their schooling, childcare and other activities,” he said. “Children are also at risk of a rare but potentially severe Covid-19 complication known as multi-system inflammatory syndrome. This requires admission to hospital and possibly the intensive care unit. We know that vaccination helps to protect children from this life-threatening condition.” According to federal Department of Health data, there have been 12 Covid deaths in zero-to-nine year-olds."
