url,id,title,section,method_queries,reason
https://www.theguardian.com/commentisfree/2021/mar/05/manufactured-crisis-free-speech-universities-freedom-of-expression-legal,commentisfree/2021/mar/05/manufactured-crisis-free-speech-universities-freedom-of-expression-legal,Ignore this manufactured crisis: free speech is alive and well in our universities | John Bowers and David Isaac,Opinion,casestudy,opinion
https://www.theguardian.com/commentisfree/2021/mar/16/boris-johnson-champion-liberty-rights-freedoms,commentisfree/2021/mar/16/boris-johnson-champion-liberty-rights-freedoms,Boris Johnson is a champion of liberty – but only for people like him | Owen Jones,Opinion,casestudy,opinion
https://www.theguardian.com/commentisfree/2020/apr/30/press-challenge-johnson-avoidable-deaths-coronavirus,commentisfree/2020/apr/30/press-challenge-johnson-avoidable-deaths-coronavirus,"If we can't criticise the government for avoidable deaths, what's the point of democracy? | Owen Jones",Opinion,casestudy,opinion
https://www.theguardian.com/commentisfree/2021/feb/28/what-does-salmond-v-sturgeon-feud-mean-for-future-of-union,commentisfree/2021/feb/28/what-does-salmond-v-sturgeon-feud-mean-for-future-of-union,What does the Salmond v Sturgeon feud mean for the future of the union? | Andrew Rawnsley,Opinion,casestudy,opinion
https://www.theguardian.com/commentisfree/2020/may/02/deliveroo-venture-capitalism-food-delivery-business-model,commentisfree/2020/may/02/deliveroo-venture-capitalism-food-delivery-business-model,Deliveroo was the poster child for venture capitalism. It's not looking so good now | James Ball,Opinion,casestudy,opinion
https://www.theguardian.com/commentisfree/2021/jun/30/the-guardian-view-on-state-subsidy-brussels-was-not-the-problem,commentisfree/2021/jun/30/the-guardian-view-on-state-subsidy-brussels-was-not-the-problem,The Guardian view on state subsidy: Brussels was not the problem | Editorial,Opinion,casestudy,opinion
https://www.theguardian.com/commentisfree/2021/feb/04/keir-starmer-vision-labour-victory,commentisfree/2021/feb/04/keir-starmer-vision-labour-victory,"Keir Starmer must call out Johnson's Covid failures, not wrap himself in the flag | Owen Jones",Opinion,casestudy,opinion
https://www.theguardian.com/world/commentisfree/2020/may/03/dan-tehan-tried-to-pressure-victoria-to-reopen-schools-but-he-went-from-raging-bull-to-mewling-kitten,world/commentisfree/2020/may/03/dan-tehan-tried-to-pressure-victoria-to-reopen-schools-but-he-went-from-raging-bull-to-mewling-kitten,"Dan Tehan tried to pressure Victoria to reopen schools, but he went from raging bull to mewling kitten | Katharine Murphy",World news,casestudy,opinion
https://www.theguardian.com/commentisfree/2020/jan/22/joe-biden-new-deal-democrat-republicans,commentisfree/2020/jan/22/joe-biden-new-deal-democrat-republicans,Joe Biden used to be a progressive Democrat. What happened? | Bhaskar Sunkara,Opinion,casestudy,opinion
https://www.theguardian.com/commentisfree/2020/apr/30/the-guardian-view-on-corporate-bailouts-money-for-something,commentisfree/2020/apr/30/the-guardian-view-on-corporate-bailouts-money-for-something,The Guardian view on corporate bailouts: money for something | Editorial,Opinion,casestudy,opinion
https://www.theguardian.com/australia-news/commentisfree/2021/jan/15/indulging-craig-kelly-misinformation-is-a-threat-to-australias-health-politically-as-well-as-literally,australia-news/commentisfree/2021/jan/15/indulging-craig-kelly-misinformation-is-a-threat-to-australias-health-politically-as-well-as-literally,"Indulging Craig Kelly's falsehoods is a threat to Australia's health, politically as well as literally | Lenore Taylor",Australia news,casestudy,opinion
https://www.theguardian.com/commentisfree/2019/oct/31/oris-ohnson-taught-us-greatest-skill-in-politics-compromise,commentisfree/2019/oct/31/oris-ohnson-taught-us-greatest-skill-in-politics-compromise,Boris Johnson has inadvertently taught us the greatest skill in politics: compromise | Martin Kettle,Opinion,casestudy,opinion
https://www.theguardian.com/commentisfree/2020/jul/05/we-knew-about-covid-in-the-towers-and-were-taking-care-but-when-we-needed-support-there-were-only-police,commentisfree/2020/jul/05/we-knew-about-covid-in-the-towers-and-were-taking-care-but-when-we-needed-support-there-were-only-police,"We knew about Covid-19 in the towers and were taking care, but instead of support there was only police | Hiba Shanino",Opinion,casestudy,opinion
https://www.theguardian.com/commentisfree/2021/may/02/westminster-eton-schoolboys-boris-johnson-david-cameron,commentisfree/2021/may/02/westminster-eton-schoolboys-boris-johnson-david-cameron,Britain’s overgrown Eton schoolboys have turned the country into their playground | John Harris,Opinion,casestudy,opinion
https://www.theguardian.com/commentisfree/2020/dec/05/companies-are-now-writing-reports-tailored-for-ai-readers-and-it-should-worry-us,commentisfree/2020/dec/05/companies-are-now-writing-reports-tailored-for-ai-readers-and-it-should-worry-us,Companies are now writing reports tailored for AI readers – and it should worry us,Opinion,casestudy,opinion
https://www.theguardian.com/commentisfree/2020/aug/13/britain-arts-africa-uk-cultural-sector,commentisfree/2020/aug/13/britain-arts-africa-uk-cultural-sector,"If Britain looked anew, it could learn so much about the arts from Africa | Afua Hirsch",Opinion,casestudy,opinion
https://www.theguardian.com/commentisfree/2018/feb/12/we-need-to-change-the-culture-of-silence-about-sexual-harassment,commentisfree/2018/feb/12/we-need-to-change-the-culture-of-silence-about-sexual-harassment,The Robert Doyle saga is a perfect case study for this messy #metoo moment | Gay Alcorn,Opinion,casestudy,opinion
https://www.theguardian.com/commentisfree/2020/oct/25/sudan-rewarded-revolution-blackmail-sanctions-us-compensation,commentisfree/2020/oct/25/sudan-rewarded-revolution-blackmail-sanctions-us-compensation,Sudan is being rewarded for its revolution with blackmail | Nesrine Malik,Opinion,casestudy,opinion
https://www.theguardian.com/commentisfree/2020/jul/05/have-a-heart-kitkat-dont-break-with-fairtrade,commentisfree/2020/jul/05/have-a-heart-kitkat-dont-break-with-fairtrade,"Have a heart, KitKat, don't break with Fairtrade",Opinion,casestudy,opinion
https://www.theguardian.com/commentisfree/2020/dec/19/liz-truss-foucault-rightwing-zombie-postmodernism,commentisfree/2020/dec/19/liz-truss-foucault-rightwing-zombie-postmodernism,"Liz Truss doesn't know about Foucault, but she also doesn't care | Charlotte Lydia Riley",Opinion,casestudy,opinion
https://www.theguardian.com/commentisfree/2020/apr/21/coronavirus-crisis-ends-bad-for-conservatism,commentisfree/2020/apr/21/coronavirus-crisis-ends-bad-for-conservatism,"No matter how this coronavirus crisis ends, it will be bad for conservatism | Zoe Williams",Opinion,casestudy,opinion
https://www.theguardian.com/commentisfree/2020/aug/25/why-im-no-tv-diversity-success-story-david-olusoga,commentisfree/2020/aug/25/why-im-no-tv-diversity-success-story-david-olusoga,Why I'm no TV diversity 'success story' | David Olusoga,Opinion,casestudy,opinion
https://www.theguardian.com/commentisfree/2020/jul/25/the-uk-app-failure-sums-up-our-fatally-flawed-coronavirus-response,commentisfree/2020/jul/25/the-uk-app-failure-sums-up-our-fatally-flawed-coronavirus-response,The UK's app failure sums up our fatally flawed coronavirus response | John Naughton,Opinion,casestudy,opinion
https://www.theguardian.com/australia-news/commentisfree/2019/jul/09/as-the-outrage-around-israel-folau-peaks-lets-turn-the-volume-down-a-notch,australia-news/commentisfree/2019/jul/09/as-the-outrage-around-israel-folau-peaks-lets-turn-the-volume-down-a-notch,"As the outrage around Israel Folau peaks, let’s turn the volume down a notch | Peter Lewis",Australia news,casestudy,opinion
https://www.theguardian.com/commentisfree/2020/mar/19/myth-blitz-spirit-model-coronavirus,commentisfree/2020/mar/19/myth-blitz-spirit-model-coronavirus,Why the cruel myth of the 'blitz spirit' is no model for how to fight coronavirus | Richard Overy,Opinion,casestudy,opinion
https://www.theguardian.com/australia-news/commentisfree/2020/aug/01/victorias-coronavirus-crisis-fear-hangs-over-melbourne-and-nothing-is-like-the-first-wave,australia-news/commentisfree/2020/aug/01/victorias-coronavirus-crisis-fear-hangs-over-melbourne-and-nothing-is-like-the-first-wave,Melbourne is shaking with fear of coronavirus – and nothing is like the first wave | Sophie Black,Australia news,casestudy,opinion
https://www.theguardian.com/commentisfree/2020/may/02/coronavirus-united-ireland-pandemic-,commentisfree/2020/may/02/coronavirus-united-ireland-pandemic-,How coronavirus is spurring the cause of a united Ireland | Una Mullally,Opinion,casestudy,opinion
https://www.theguardian.com/commentisfree/2019/apr/11/virgin-trains-branson-british-rail,commentisfree/2019/apr/11/virgin-trains-branson-british-rail,Virgin Trains is a Bransonian dystopia – good riddance to it | Lynsey Hanley,Opinion,casestudy,opinion
https://www.theguardian.com/commentisfree/2020/aug/15/cardi-b-megan-thee-stalion-wap-conservatives-female-sexuality,commentisfree/2020/aug/15/cardi-b-megan-thee-stalion-wap-conservatives-female-sexuality,The WAP uproar shows conservatives are fine with female sexuality – as long as men control it | Arwa Mahdawi,Opinion,casestudy,opinion
https://www.theguardian.com/commentisfree/2019/feb/01/work-four-day-week-workloads-stress-economy,commentisfree/2019/feb/01/work-four-day-week-workloads-stress-economy,Work isn’t working – but a four-day week would help fix it | Will Stronge,Opinion,casestudy,opinion
https://www.theguardian.com/commentisfree/2019/dec/18/britain-election-us-corbyn-sanders-trump-johnson,commentisfree/2019/dec/18/britain-election-us-corbyn-sanders-trump-johnson,Britain may be completely different to the US – but we can still learn from its election | Geoffrey Kabaservice,Opinion,casestudy,opinion
https://www.theguardian.com/commentisfree/2019/sep/18/nhs-social-workers-patients-funding,commentisfree/2019/sep/18/nhs-social-workers-patients-funding,The NHS saved Mum - but I saw a system on life support | Diane Taylor,Opinion,casestudy,opinion
https://www.theguardian.com/commentisfree/2018/oct/10/corbynism-work-government-borough-haringey,commentisfree/2018/oct/10/corbynism-work-government-borough-haringey,How would Corbynism work in government? Here’s a clue | Aditya Chakrabortty,Opinion,casestudy,opinion
https://www.theguardian.com/commentisfree/2020/may/17/trump-putin-and-bolsonaro-have-been-complacent-now-the-pandemic-has-made-them-all-vulnerable,commentisfree/2020/may/17/trump-putin-and-bolsonaro-have-been-complacent-now-the-pandemic-has-made-them-all-vulnerable,"Trump, Putin and Bolsonaro have been complacent. Now the pandemic has made them all vulnerable | Simon Tisdall",Opinion,casestudy,opinion
https://www.theguardian.com/commentisfree/2017/mar/14/gulf-of-carpentarias-record-mangrove-dieback-is-a-case-study-of-extremes,commentisfree/2017/mar/14/gulf-of-carpentarias-record-mangrove-dieback-is-a-case-study-of-extremes,Gulf of Carpentaria's record mangrove dieback is a case study of extremes,Opinion,casestudy,opinion
https://www.theguardian.com/commentisfree/2019/may/23/racism-football-workplace-racist,commentisfree/2019/may/23/racism-football-workplace-racist,We recognise racism on the football pitch. Why do we fail to see it in the workplace? | Nels Abbey,Opinion,casestudy,opinion
https://www.theguardian.com/commentisfree/2020/feb/14/market-universities-crisis-staff-strike,commentisfree/2020/feb/14/market-universities-crisis-staff-strike,Market economics has driven universities into crisis – and we’re all paying the price | Owen Jones,Opinion,casestudy,opinion
https://www.theguardian.com/commentisfree/2019/sep/13/integration-racism-assimilation-britain-heritage,commentisfree/2019/sep/13/integration-racism-assimilation-britain-heritage,We have to avoid 'integration' becoming another form of racism | Afua Hirsch,Opinion,casestudy,opinion
https://www.theguardian.com/commentisfree/2019/jul/15/jeremy-hunt-britain-iran-crisis-eu-brexit-brussels,commentisfree/2019/jul/15/jeremy-hunt-britain-iran-crisis-eu-brexit-brussels,It’s folly for Jeremy Hunt to think Britain can solve the Iran crisis without the EU | Simon Tisdall,Opinion,casestudy,opinion
https://www.theguardian.com/commentisfree/2019/apr/19/newcastle-radical-metro-mayor-corbynista,commentisfree/2019/apr/19/newcastle-radical-metro-mayor-corbynista,"Newcastle can be the capital of a new, radical British politics | Aditya Chakrabortty",Opinion,casestudy,opinion
https://www.theguardian.com/commentisfree/2018/mar/06/nepotism-corruption-handmaiden-trump-presidency,commentisfree/2018/mar/06/nepotism-corruption-handmaiden-trump-presidency,Nepotism and corruption: the handmaidens of Trump's presidency | Jill Abramson,Opinion,casestudy,opinion
https://www.theguardian.com/commentisfree/2018/oct/17/preaching-to-asylum-seekers-about-loneliness-takes-some-nerve,commentisfree/2018/oct/17/preaching-to-asylum-seekers-about-loneliness-takes-some-nerve,Preaching to asylum seekers about loneliness takes some nerve | Rivkah Brown,Opinion,casestudy,opinion
https://www.theguardian.com/commentisfree/2018/oct/30/angela-merkel-exit-gaping-hole-centrist-politics,commentisfree/2018/oct/30/angela-merkel-exit-gaping-hole-centrist-politics,Merkel’s exit will leave a gaping hole in centrist politics | Rafael Behr,Opinion,casestudy,opinion
https://www.theguardian.com/commentisfree/2019/apr/22/tories-schools-austerity-cuts-politicians,commentisfree/2019/apr/22/tories-schools-austerity-cuts-politicians,Our schools are beyond breaking point – where is the outrage? | John Harris,Opinion,casestudy,opinion
https://www.theguardian.com/commentisfree/2019/apr/28/forty-years-ago-thatcherism-swept-britain-could-our-new-parties-repeat-the-trick,commentisfree/2019/apr/28/forty-years-ago-thatcherism-swept-britain-could-our-new-parties-repeat-the-trick,"Forty years ago, Thatcherism swept Britain. Could our new parties repeat the trick? | Tim Bale",Opinion,casestudy,opinion
https://www.theguardian.com/commentisfree/2019/feb/24/facebook-economy-health-democracy-threat,commentisfree/2019/feb/24/facebook-economy-health-democracy-threat,"Facebook threatens the economy, health and democracy | Ganesh Sitaraman",Opinion,casestudy,opinion
https://www.theguardian.com/commentisfree/2019/may/03/demise-middle-classes-british-politics-digital-age,commentisfree/2019/may/03/demise-middle-classes-british-politics-digital-age,The demise of the middle classes is toxifying British politics  | Larry Elliott,Opinion,casestudy,opinion
https://www.theguardian.com/commentisfree/2018/oct/11/shaun-bailey-offensive-comments-london-mayor-candidate,commentisfree/2018/oct/11/shaun-bailey-offensive-comments-london-mayor-candidate,Shaun Bailey’s offensive comments make him unfit to be London mayor | Kimberly McIntosh,Opinion,casestudy,opinion
https://www.theguardian.com/global/commentisfree/2018/may/19/bring-back-joy-of-teaching-letters,global/commentisfree/2018/may/19/bring-back-joy-of-teaching-letters,Bring back joy to the classroom | Letters,Global,casestudy,opinion
https://www.theguardian.com/commentisfree/2019/may/01/greta-thunberg-right-environmental-activist-attacks,commentisfree/2019/may/01/greta-thunberg-right-environmental-activist-attacks,The hounding of Greta Thunberg is proof that the right have run out of ideas | Aditya Chakrabortty,Opinion,casestudy,opinion
https://www.theguardian.com/commentisfree/2017/nov/27/white-paper-industrial-strategy-government-economy,commentisfree/2017/nov/27/white-paper-industrial-strategy-government-economy,Why this white paper on industrial strategy is good news (mostly) | Michael Jacobs,Opinion,casestudy,opinion
https://www.theguardian.com/commentisfree/2018/nov/02/election-campaign-financing-threatens-british-democracy-arron-banks,commentisfree/2018/nov/02/election-campaign-financing-threatens-british-democracy-arron-banks,Opaque election campaign financing threatens British democracy | Stephen Kinnock,Opinion,casestudy,opinion
https://www.theguardian.com/technology/commentisfree/2018/nov/18/computers-have-learned-to-make-us-jump-through-hoops,technology/commentisfree/2018/nov/18/computers-have-learned-to-make-us-jump-through-hoops,Computers have learned to make us jump through hoops | John Naughton,Technology,casestudy,opinion
https://www.theguardian.com/commentisfree/2018/mar/21/failing-mental-healthcare-violating-basic-human-rights,commentisfree/2018/mar/21/failing-mental-healthcare-violating-basic-human-rights,Failings in mental healthcare are violating basic human rights | Rob Behrens,Opinion,casestudy,opinion
https://www.theguardian.com/commentisfree/2018/nov/19/brexit-class-labour-conservative-leave-peoples-vote,commentisfree/2018/nov/19/brexit-class-labour-conservative-leave-peoples-vote,Brexit is a class betrayal. So why is Labour colluding in it? | John Harris,Opinion,casestudy,opinion
https://www.theguardian.com/commentisfree/2024/sep/13/the-guardian-view-on-assisted-dying-mps-ought-to-consider-the-issue,commentisfree/2024/sep/13/the-guardian-view-on-assisted-dying-mps-ought-to-consider-the-issue,The Guardian view on assisted dying: MPs ought to consider the issue | Editorial,Opinion,expert_qual,opinion
https://www.theguardian.com/commentisfree/2025/jul/09/the-guardian-view-on-restricting-trial-by-jury-the-ugly-face-of-justice-tailored-to-tight-budgets,commentisfree/2025/jul/09/the-guardian-view-on-restricting-trial-by-jury-the-ugly-face-of-justice-tailored-to-tight-budgets,The Guardian view on restricting trial by jury: the ugly face of justice tailored to tight budgets | Editorial,Opinion,expert_qual,opinion
https://www.theguardian.com/commentisfree/2024/dec/19/england-local-government-angela-rayner-white-paper,commentisfree/2024/dec/19/england-local-government-angela-rayner-white-paper,We now have a plan to make England's local government work – but I fear party politics will trash it | Martin Kettle,Opinion,expert_qual,opinion
https://www.theguardian.com/commentisfree/2025/may/01/tony-blair-climate-uk-policy-undermine,commentisfree/2025/may/01/tony-blair-climate-uk-policy-undermine,I worked with Tony Blair when he put climate at the heart of UK policy. He must not now undermine that | David King,Opinion,expert_qual,opinion
https://www.theguardian.com/commentisfree/2025/may/12/greece-is-booming-again-this-time-will-it-last,commentisfree/2025/may/12/greece-is-booming-again-this-time-will-it-last,"Greece is booming again. This time, will it last? | Paul Taylor",Opinion,expert_qual,opinion
https://www.theguardian.com/commentisfree/2025/jul/15/sheep-destroying-british-habitats-taxpayers-dartmoor-farming,commentisfree/2025/jul/15/sheep-destroying-british-habitats-taxpayers-dartmoor-farming,Sheep are destroying precious British habitats – and we taxpayers are footing the bill | Chris Packham,Opinion,expert_qual,opinion
https://www.theguardian.com/commentisfree/2025/jun/16/mps-assisted-dying-bill-law-palliative-care,commentisfree/2025/jun/16/mps-assisted-dying-bill-law-palliative-care,"MPs have personal beliefs, but also solemn duties: that’s why they must reject the assisted dying bill this week | Gordon Brown",Opinion,expert_qual,opinion
https://www.theguardian.com/commentisfree/2024/nov/26/what-has-happened-to-gambling-reform-under-labor-its-simple-the-government-has-been-cowed-by-vested-interests,commentisfree/2024/nov/26/what-has-happened-to-gambling-reform-under-labor-its-simple-the-government-has-been-cowed-by-vested-interests,What has happened to gambling reform under Labor? It’s simple – the government has been cowed by vested interests | Tim Costello,Opinion,expert_qual,opinion
https://www.theguardian.com/commentisfree/article/2024/aug/04/bma-stance-on-puberty-blockers-defies-first-principle-of-medicine-first-do-no-harm-cass-review,commentisfree/article/2024/aug/04/bma-stance-on-puberty-blockers-defies-first-principle-of-medicine-first-do-no-harm-cass-review,"The BMA’s stance  on puberty blockers defies the key principle of medicine: first, do no harm | Sonia Sodha",Opinion,expert_qual,opinion
https://www.theguardian.com/commentisfree/2024/apr/26/cass-review-gender-identity-services-report,commentisfree/2024/apr/26/cass-review-gender-identity-services-report,The Cass review of gender identity services marks a return to reason and evidence – it must be defended | David Bell,Opinion,expert_qual,opinion
https://www.theguardian.com/commentisfree/2024/nov/06/the-guardian-view-on-fixing-the-mental-health-act-an-overdue-return-to-dignity,commentisfree/2024/nov/06/the-guardian-view-on-fixing-the-mental-health-act-an-overdue-return-to-dignity,The Guardian view on fixing the Mental Health Act: an overdue return to dignity | Editorial,Opinion,expert_qual,opinion
https://www.theguardian.com/commentisfree/2024/nov/27/mps-assisted-dying-bill-vote-right-to-die,commentisfree/2024/nov/27/mps-assisted-dying-bill-vote-right-to-die,"MPs will vote, but there is a better way to decide who has the right to die | Rafael Behr",Opinion,expert_qual,opinion
https://www.theguardian.com/media/commentisfree/2025/aug/01/schwartz-media-journalists-banned-from-7am-podcast-after-gaza-episode-prompts-negative-comments,media/commentisfree/2025/aug/01/schwartz-media-journalists-banned-from-7am-podcast-after-gaza-episode-prompts-negative-comments,Schwartz Media journalists banned from 7am podcast after Gaza episode prompts negative comments | Weekly Beast,Media,expert_qual,opinion
https://www.theguardian.com/commentisfree/article/2024/sep/07/bma-cass-report-gender-identity-services,commentisfree/article/2024/sep/07/bma-cass-report-gender-identity-services,Undemocratic and secretive: the BMA no longer speaks for doctors trying to protect children | Jacky Davis,Opinion,expert_qual,opinion
https://www.theguardian.com/politics/commentisfree/2024/apr/27/dan-poulter-resigning-conservative-party-labour-nhs,politics/commentisfree/2024/apr/27/dan-poulter-resigning-conservative-party-labour-nhs,I am resigning from the Tory party and joining Labour: only it wants to restore our NHS | Dan Poulter,Politics,expert_qual,opinion
https://www.theguardian.com/commentisfree/article/2024/jul/11/gaza-unexploded-bombs,commentisfree/article/2024/jul/11/gaza-unexploded-bombs,"I’ll be helping to clear unexploded bombs in Gaza, my home. But I dread what I will find there | Haniya Albaioumy",Opinion,expert_qual,opinion
https://www.theguardian.com/commentisfree/2025/may/27/the-guardian-view-on-young-offenders-amid-rising-violence-they-need-support-to-change,commentisfree/2025/may/27/the-guardian-view-on-young-offenders-amid-rising-violence-they-need-support-to-change,"The Guardian view on young offenders: amid rising violence, they need support to change | Editorial",Opinion,expert_qual,opinion
https://www.theguardian.com/commentisfree/2023/nov/03/scientific-advisers-covid-inquiry-chris-whitty-scientists,commentisfree/2023/nov/03/scientific-advisers-covid-inquiry-chris-whitty-scientists,I feared scientific advisers were being used by the government – the Covid inquiry shows they were | Devi Shridhar,Opinion,expert_qual,opinion
https://www.theguardian.com/commentisfree/article/2024/jun/19/rishi-sunak-natural-england-election-labour-wildlife,commentisfree/article/2024/jun/19/rishi-sunak-natural-england-election-labour-wildlife,Sunak’s government has almost destroyed Natural England – just for doing its job | Guy Shrubsole,Opinion,expert_qual,opinion
https://www.theguardian.com/commentisfree/article/2024/may/27/humanity-survival-emissions-resilience-ecosystems-greenhouse-gases,commentisfree/article/2024/may/27/humanity-survival-emissions-resilience-ecosystems-greenhouse-gases,Humanity’s survival is still within our grasp – just. But only if we take these radical steps | David King,Opinion,expert_qual,opinion
https://www.theguardian.com/commentisfree/2023/nov/20/the-guardian-view-on-the-covid-inquiry-scientists-and-the-government-under-the-microscope,commentisfree/2023/nov/20/the-guardian-view-on-the-covid-inquiry-scientists-and-the-government-under-the-microscope,The Guardian view on the Covid inquiry: scientists and the government under the microscope | Editorial,Opinion,expert_qual,opinion
https://www.theguardian.com/commentisfree/2025/apr/07/climate-solutions-extreme-options,commentisfree/2025/apr/07/climate-solutions-extreme-options,We passed the 1.5C climate threshhold. We must now explore extreme options | Sir David King,Opinion,expert_qual,opinion
https://www.theguardian.com/commentisfree/2024/oct/18/maeve-bothby-oneill-me-chronic-fatigue-syndrome,commentisfree/2024/oct/18/maeve-bothby-oneill-me-chronic-fatigue-syndrome,Maeve Boothby O’Neill died because of a discredited view of ME. How was this allowed to happen? | George Monbiot,Opinion,expert_qual,opinion
https://www.theguardian.com/commentisfree/2025/feb/16/punishment-crime-britain-jails-overflowing,commentisfree/2025/feb/16/punishment-crime-britain-jails-overflowing,The punishment doesn’t fit the crime in Britain. That’s why our jails are overflowing | Samira Shackle,Opinion,expert_qual,opinion
https://www.theguardian.com/commentisfree/2025/feb/14/land-use-policy-tories-conservative-england,commentisfree/2025/feb/14/land-use-policy-tories-conservative-england,"That new land use policy that the Tories call ‘national suicide’? It’s urgent, essential – and their idea | Henry Dimbleby",Opinion,expert_qual,opinion
https://www.theguardian.com/commentisfree/2025/jul/15/afghanistan-uk-data-leak-taliban-britain,commentisfree/2025/jul/15/afghanistan-uk-data-leak-taliban-britain,Afghans have been betrayed yet again by this shocking UK data leak – and many don’t even know if they’re affected | Diane Taylor,Opinion,expert_qual,opinion
