url,id,title,section,method_queries,reason
https://www.theguardian.com/commentisfree/2013/nov/30/gonski-christopher-pyne-should-know-that-australia-isnt-england,commentisfree/2013/nov/30/gonski-christopher-pyne-should-know-that-australia-isnt-england,Gonski: Christopher Pyne should know that Australia isn't England  | Tom Bentley,Opinion,gut,opinion
https://www.theguardian.com/commentisfree/2012/jan/15/dont-blame-ratings-euro-turmoil,commentisfree/2012/jan/15/dont-blame-ratings-euro-turmoil,Don't blame the ratings agencies for the eurozone turmoil | Ha-Joon Chang,Opinion,gut,opinion
https://www.theguardian.com/commentisfree/2013/aug/25/capitalism-consumerism-human-need-resources,commentisfree/2013/aug/25/capitalism-consumerism-human-need-resources,Should you offer your lover a wad of £10 notes instead of a worthless kiss? | AL Kennedy,Opinion,gut,opinion
https://www.theguardian.com/commentisfree/2013/jul/10/washington-post-walter-pincus-correction,commentisfree/2013/jul/10/washington-post-walter-pincus-correction,The journalistic practices of the Washington Post and Walter Pincus | Glenn Greenwald,Opinion,gut,opinion
https://www.theguardian.com/commentisfree/2012/nov/16/obama-second-term-failed-war-on-drugs,commentisfree/2012/nov/16/obama-second-term-failed-war-on-drugs,Will Obama's second term see an end to the failed 'war on drugs'? | Sadhbh Walshe,Opinion,gut,opinion
https://www.theguardian.com/commentisfree/2013/jun/06/ed-miliband-social-security-speech,commentisfree/2013/jun/06/ed-miliband-social-security-speech,Did Ed Miliband's social security speech get it right? | The panel,Opinion,gut,opinion
https://www.theguardian.com/commentisfree/2010/nov/04/world-economy-desperate-measures,commentisfree/2010/nov/04/world-economy-desperate-measures,The world economy: Desperate measures,Opinion,gut,opinion
https://www.theguardian.com/commentisfree/2012/mar/04/manifesto-for-a-model-mayor-london,commentisfree/2012/mar/04/manifesto-for-a-model-mayor-london,Help me create a manifesto for a model mayor | Dave Hill,Opinion,gut,opinion
https://www.theguardian.com/commentisfree/cifamerica/2011/oct/31/lisa-simeone-npr-executive-cowardice,commentisfree/cifamerica/2011/oct/31/lisa-simeone-npr-executive-cowardice,Lisa Simeone and NPR's executive cowardice | Dan Gillmor,Media,gut,opinion
https://www.theguardian.com/commentisfree/2010/nov/15/happiness-scientific-david-cameron,commentisfree/2010/nov/15/happiness-scientific-david-cameron,Happiness is ... becoming a bit more scientific  | Barbara Gunnell,Opinion,gut,opinion
https://www.theguardian.com/commentisfree/cifamerica/2010/dec/16/julian-assange-wikileaks-eric-holder,commentisfree/cifamerica/2010/dec/16/julian-assange-wikileaks-eric-holder,WikiLeaks and the first amendment | Dan Kennedy,Opinion,gut,opinion
https://www.theguardian.com/commentisfree/2010/feb/24/sutton-transport-scheme-rise,commentisfree/2010/feb/24/sutton-transport-scheme-rise,Sutton's smart transport example | Dave Hill,Opinion,gut,opinion
https://www.theguardian.com/commentisfree/cifamerica/2009/aug/13/us-immigration-reform-detention-obama,commentisfree/cifamerica/2009/aug/13/us-immigration-reform-detention-obama,America's broken immigration system | Wajahat Ali,Opinion,gut,opinion
https://www.theguardian.com/commentisfree/2009/apr/08/health-society-politics,commentisfree/2009/apr/08/health-society-politics,Darian Leader: Counselling doesn't fit the commoditised NHS model,Opinion,gut,opinion
https://www.theguardian.com/commentisfree/2008/mar/25/gearingforafight,commentisfree/2008/mar/25/gearingforafight,Gearing for a fight,Opinion,gut,opinion
https://www.theguardian.com/commentisfree/2007/jun/19/oneoftheconsequencesof,commentisfree/2007/jun/19/oneoftheconsequencesof,"Immigration, round two",Opinion,gut,opinion
https://www.theguardian.com/commentisfree/2006/jun/20/lopsided,commentisfree/2006/jun/20/lopsided,From bad to worse,Opinion,gut,opinion
https://www.theguardian.com/commentisfree/2016/jun/26/algorithms-racial-bias-offenders-florida,commentisfree/2016/jun/26/algorithms-racial-bias-offenders-florida,Even algorithms are biased against black men,Opinion,prepost,opinion
https://www.theguardian.com/commentisfree/cifamerica/2011/feb/28/chile-natural-disasters,commentisfree/cifamerica/2011/feb/28/chile-natural-disasters,Chile and earthquake reconstruction | Catalina May,World news,prepost,opinion
https://www.theguardian.com/commentisfree/2025/jun/18/sweaty-and-flustered-my-breast-cancer-patient-was-experiencing-hot-flushes-the-lack-of-good-treatment-is-frustrating,commentisfree/2025/jun/18/sweaty-and-flustered-my-breast-cancer-patient-was-experiencing-hot-flushes-the-lack-of-good-treatment-is-frustrating,"Sweaty and flustered, my breast cancer patient was experiencing hot flushes. The lack of good treatment is frustrating | Ranjana Srivastava",Opinion,rct,opinion
https://www.theguardian.com/commentisfree/2025/jul/04/exercise-drugs-cancer-remission,commentisfree/2025/jul/04/exercise-drugs-cancer-remission,Is exercise really better than drugs for cancer remission? It's an appealing idea – but it's misleading | Devi Sridhar,Opinion,rct,opinion
https://www.theguardian.com/commentisfree/2024/jan/02/truth-about-ultra-processed-foods-upfs,commentisfree/2024/jan/02/truth-about-ultra-processed-foods-upfs,Beware the mix of food and fear – the truth about ultra-processed foods is still emerging | Amelia Tait,Opinion,rct,opinion
https://www.theguardian.com/commentisfree/2023/sep/30/google-antitrust-us-department-of-justice-court-case-monopoly,commentisfree/2023/sep/30/google-antitrust-us-department-of-justice-court-case-monopoly,Has Google’s monopoly on the search engine market finally timed out? | John Naughton,Opinion,rct,opinion
https://www.theguardian.com/commentisfree/2023/apr/30/im-a-science-factchecker-and-even-i-was-overwhelmed-researching-pregnancy-and-baby-advice,commentisfree/2023/apr/30/im-a-science-factchecker-and-even-i-was-overwhelmed-researching-pregnancy-and-baby-advice,I’m a science factchecker and even I was overwhelmed researching pregnancy and baby advice | Gideon Meyerowitz-Katz,Opinion,rct,opinion
https://www.theguardian.com/commentisfree/2020/nov/10/hurdles-covid-19-vaccine-science-solutions-pandemic,commentisfree/2020/nov/10/hurdles-covid-19-vaccine-science-solutions-pandemic,"Despite the fine print, we can still feel optimistic about a Covid vaccine | Charlotte Summers",Opinion,rct,opinion
https://www.theguardian.com/commentisfree/2021/oct/24/which-protects-you-more-vaccination-or-prior-infection,commentisfree/2021/oct/24/which-protects-you-more-vaccination-or-prior-infection,Which protects you more against Covid – vaccination or prior infection? | David Spiegelhalter and Anthony Masters,From the Observer,rct,opinion
https://www.theguardian.com/theobserver/commentisfree/2021/feb/21/is-12-weeks-between-covid-jabs-too-long,theobserver/commentisfree/2021/feb/21/is-12-weeks-between-covid-jabs-too-long,Is 12 weeks between Covid jabs too long? | David Spiegelhalter and Anthony Masters,From the Observer,rct,opinion
https://www.theguardian.com/commentisfree/2020/jul/21/vaccine-treatements-interferon-beta-1a-therapy,commentisfree/2020/jul/21/vaccine-treatements-interferon-beta-1a-therapy,"Before a vaccine, we'll need treatments. Is interferon beta-1a a game changer? | Charlotte Summers",Opinion,rct,opinion
https://www.theguardian.com/commentisfree/2020/jun/05/face-masks-coronavirus,commentisfree/2020/jun/05/face-masks-coronavirus,We can't be 100% sure face masks work – but that shouldn't stop us wearing them | Trish Greenhalgh,Opinion,rct,opinion
https://www.theguardian.com/commentisfree/2021/apr/20/psychedelics-depression-treatment-psychiatry-psilocybin,commentisfree/2021/apr/20/psychedelics-depression-treatment-psychiatry-psilocybin,Psychedelics are transforming the way we understand depression and its treatment | Robin Carhart-Harris,Opinion,rct,opinion
https://www.theguardian.com/commentisfree/2020/dec/01/uk-students-tests-coronavirus-testing-university-false-negative-results,commentisfree/2020/dec/01/uk-students-tests-coronavirus-testing-university-false-negative-results,The UK government must be honest with students – tests can miss coronavirus | Sian Taylor Phillips,Opinion,rct,opinion
https://www.theguardian.com/commentisfree/2020/nov/22/we-need-scientists-to-quiz-covid-consensus-not-act-as-agents-of-disinformation,commentisfree/2020/nov/22/we-need-scientists-to-quiz-covid-consensus-not-act-as-agents-of-disinformation,"We need scientists to quiz Covid consensus, not act as agents of disinformation | Sonia Sodha",Opinion,rct,opinion
https://www.theguardian.com/commentisfree/2020/sep/10/oxford-coronavirus-vaccine-trial-covid-19-pandemic,commentisfree/2020/sep/10/oxford-coronavirus-vaccine-trial-covid-19-pandemic,Don't jump to conclusions about the Oxford vaccine trial suspension | Charlotte Summers,Opinion,rct,opinion
https://www.theguardian.com/commentisfree/2020/aug/20/politicians-doctors-lethal-mistakes-covid-lives-admit,commentisfree/2020/aug/20/politicians-doctors-lethal-mistakes-covid-lives-admit,Politicians and doctors both make lethal mistakes – but doctors own up to theirs | Farrah Jarral,Opinion,rct,opinion
https://www.theguardian.com/commentisfree/2020/apr/03/face-masks-coronavirus-scientists-evidence-covid-19-public,commentisfree/2020/apr/03/face-masks-coronavirus-scientists-evidence-covid-19-public,Do face masks protect against coronavirus? Here's what scientists know so far | David Heymann,Opinion,rct,opinion
https://www.theguardian.com/commentisfree/2020/apr/24/face-masks-mandatory-spread-coronavirus-government,commentisfree/2020/apr/24/face-masks-mandatory-spread-coronavirus-government,"Across the world, face masks are becoming mandatory. Why not in the UK? | Babak Javid",Opinion,rct,opinion
https://www.theguardian.com/commentisfree/2020/jan/19/inflammation-depression-mind-body,commentisfree/2020/jan/19/inflammation-depression-mind-body,"From depression to dementia, inflammation is medicine’s new frontier | Edward Bullmore",Opinion,rct,opinion
https://www.theguardian.com/commentisfree/2020/apr/05/1918-flu-pandemic-coronavirus-drug-trials-scientists-treatments-evidence,commentisfree/2020/apr/05/1918-flu-pandemic-coronavirus-drug-trials-scientists-treatments-evidence,What the 1918 flu pandemic can teach us about coronavirus drug trials | Laura Spinney,Opinion,rct,opinion
https://www.theguardian.com/commentisfree/2019/may/06/heres-why-moderate-drinking-is-probably-not-good-for-you,commentisfree/2019/may/06/heres-why-moderate-drinking-is-probably-not-good-for-you,Here's why moderate drinking is probably not good for you | Gideon Meyerowitz-Katz,Opinion,rct,opinion
https://www.theguardian.com/commentisfree/2018/jul/11/intensive-care-units-are-intimidating-its-crucial-that-doctors-really-listen,commentisfree/2018/jul/11/intensive-care-units-are-intimidating-its-crucial-that-doctors-really-listen,Intensive care units are intimidating. It’s crucial that doctors really listen | Ranjana Srivastava,Opinion,rct,opinion
https://www.theguardian.com/commentisfree/2016/sep/13/statins-patients-are-allowed-to-make-poor-choices-but-the-media-shouldnt-help-them,commentisfree/2016/sep/13/statins-patients-are-allowed-to-make-poor-choices-but-the-media-shouldnt-help-them,Statins: Patients are allowed to make poor choices but the media shouldn’t help them | Ranjana Srivastava,Opinion,rct,opinion
https://www.theguardian.com/commentisfree/2016/nov/15/sore-throats-pharmacies-nhs,commentisfree/2016/nov/15/sore-throats-pharmacies-nhs,Testing sore throats at pharmacies won’t solve anything | Margaret McCartney,Opinion,rct,opinion
https://www.theguardian.com/commentisfree/2016/aug/03/naplan-results-we-should-be-wary-of-simplistic-arguments-about-funding,commentisfree/2016/aug/03/naplan-results-we-should-be-wary-of-simplistic-arguments-about-funding,Education funding: we should be wary of simplistic arguments about money and outcomes | Peter Goss,Opinion,rct,opinion
https://www.theguardian.com/commentisfree/2014/nov/14/cancer-downton-abbey-doctors-times-medical-innovation-bill,commentisfree/2014/nov/14/cancer-downton-abbey-doctors-times-medical-innovation-bill,Cancer patients are dying because of our Downton Abbey treatment system | Maurice Saatchi,Opinion,rct,opinion
https://www.theguardian.com/commentisfree/2014/nov/24/class-baby-breastfed-life-chances-inequality,commentisfree/2014/nov/24/class-baby-breastfed-life-chances-inequality,"It’s class, not whether a baby is breastfed, that determines life chances | Eliane Glaser",Opinion,rct,opinion
https://www.theguardian.com/commentisfree/2011/sep/30/run-your-own-scientific-trials,commentisfree/2011/sep/30/run-your-own-scientific-trials,"If you want answers, why not run your own trials? | Ben Goldacre",Opinion,rct,opinion
https://www.theguardian.com/commentisfree/2012/jun/06/exercise-depression-research-misses-point,commentisfree/2012/jun/06/exercise-depression-research-misses-point,Exercise is no panacea for depression – but it keeps it at bay | Simon Hattenstone,Opinion,rct,opinion
https://www.theguardian.com/commentisfree/2011/may/14/bad-science-ben-goldacre-randomised-trials,commentisfree/2011/may/14/bad-science-ben-goldacre-randomised-trials,How can you tell if a policy is working? Run a trial | Ben Goldacre,Opinion,rct,opinion
https://www.theguardian.com/commentisfree/2012/jan/26/vitamin-d-deficiency,commentisfree/2012/jan/26/vitamin-d-deficiency,Why I'm off for some vitamin D – until the sun comes out | Ann Robinson,Opinion,rct,opinion
https://www.theguardian.com/commentisfree/2011/aug/26/bad-science-vitamin-pills-lead-you-to-take-risks,commentisfree/2011/aug/26/bad-science-vitamin-pills-lead-you-to-take-risks,Vitamin pills can lead you to take health risks | Ben Goldacre,Opinion,rct,opinion
https://www.theguardian.com/commentisfree/2011/jul/15/bad-science-studies-show-we-get-things-wrong,commentisfree/2011/jul/15/bad-science-studies-show-we-get-things-wrong,Studies of studies show that we get things wrong | Ben Goldacre,Opinion,rct,opinion
https://www.theguardian.com/commentisfree/2010/may/09/medical-science,commentisfree/2010/may/09/medical-science,"Let's improve medical science, for free | Jamie Horder",Opinion,rct,opinion
https://www.theguardian.com/commentisfree/cifamerica/2011/mar/27/schools-teaching,commentisfree/cifamerica/2011/mar/27/schools-teaching,No merit in merit pay for teachers | Walt Gardner,Opinion,rct,opinion
https://www.theguardian.com/commentisfree/2010/jul/31/ben-goldacre-teaching-reading-shootout,commentisfree/2010/jul/31/ben-goldacre-teaching-reading-shootout,A 'shoot-out' between methods won't help us teach more children to read,Opinion,rct,opinion
https://www.theguardian.com/commentisfree/2010/dec/17/bad-science-review-of-the-year,commentisfree/2010/dec/17/bad-science-review-of-the-year,Dodgy dealings in tough year for whistleblowers | Ben Goldacre,Opinion,rct,opinion
https://www.theguardian.com/commentisfree/2010/sep/11/bad-science-pope-anti-condom,commentisfree/2010/sep/11/bad-science-pope-anti-condom,Pope's anti-condom message is sabotage in fight against Aids | Ben Goldacre,Opinion,rct,opinion
https://www.theguardian.com/commentisfree/2010/aug/28/bad-science-life-saving-drugs,commentisfree/2010/aug/28/bad-science-life-saving-drugs,Costly life-saving drugs: you have to draw the line somewhere | Ben Goldacre,Opinion,rct,opinion
https://www.theguardian.com/commentisfree/2010/may/28/fair-access-oxbridge-social-elite,commentisfree/2010/may/28/fair-access-oxbridge-social-elite,Response: This simplistic solution to Oxbridge elitism won't work,Opinion,rct,opinion
https://www.theguardian.com/commentisfree/2008/dec/27/bad-science-2008-media-roundup,commentisfree/2008/dec/27/bad-science-2008-media-roundup,Ben Goldacre: Vintage year for iffy studies and selective reporting,Opinion,rct,opinion
https://www.theguardian.com/commentisfree/belief/2010/jan/05/religion-buddhism,commentisfree/belief/2010/jan/05/religion-buddhism,Buddhism beats depression | Ed Halliwell,Opinion,rct,opinion
https://www.theguardian.com/commentisfree/2009/nov/07/bad-science-nott-drugs,commentisfree/2009/nov/07/bad-science-nott-drugs,Are your drugs laws working? Ask a scientist,Opinion,rct,opinion
https://www.theguardian.com/commentisfree/2010/mar/16/nhs-domestic-violence-women,commentisfree/2010/mar/16/nhs-domestic-violence-women,The NHS is failing on domestic violence | Richard Smith,Opinion,rct,opinion
https://www.theguardian.com/commentisfree/2008/aug/08/health.medicalresearch,commentisfree/2008/aug/08/health.medicalresearch,Richard Smith: How can we best advise individual patients?,Opinion,rct,opinion
https://www.theguardian.com/commentisfree/2008/apr/12/health.medicalresearch,commentisfree/2008/apr/12/health.medicalresearch,Bad science: Arbitrary decisions on additives,Opinion,rct,opinion
https://www.theguardian.com/commentisfree/2006/sep/05/health.food,commentisfree/2006/sep/05/health.food,Richard Smith: The truth about juice,Opinion,rct,opinion
https://www.theguardian.com/commentisfree/2006/sep/04/fruitjuicefantasia,commentisfree/2006/sep/04/fruitjuicefantasia,Turning up the juice,Opinion,rct,opinion
https://www.theguardian.com/commentisfree/2007/jul/21/comment.badscience,commentisfree/2007/jul/21/comment.badscience,Bad Science: Testing social policy,Opinion,rct,opinion
https://www.theguardian.com/commentisfree/2007/mar/25/annrobinson,commentisfree/2007/mar/25/annrobinson,A complementary education,Opinion,rct,opinion
https://www.theguardian.com/commentisfree/2006/oct/30/bewaremedicaljournals,commentisfree/2006/oct/30/bewaremedicaljournals,Casualties of fraud,Opinion,rct,opinion
