url,id,title,section,method_queries,reason
https://www.theguardian.com/commentisfree/article/2024/may/18/child-care-cost-year-wealth-funds-councils-britain-residential,commentisfree/article/2024/may/18/child-care-cost-year-wealth-funds-councils-britain-residential,"How can a child in care cost £281,000 a year? Ask the wealth funds that have councils over a barrel | George Monbiot",Opinion,expert_qual,opinion
https://www.theguardian.com/commentisfree/2023/dec/15/bbc-chair-samir-shah-expert-panel-press-public,commentisfree/2023/dec/15/bbc-chair-samir-shah-expert-panel-press-public,"As BBC chair, Samir Shah, here’s what you’ve got to do | Opinion panel",Opinion,expert_qual,opinion
https://www.theguardian.com/commentisfree/2023/jul/14/rishi-sunak-public-sector-pay-rises-education-nhs,commentisfree/2023/jul/14/rishi-sunak-public-sector-pay-rises-education-nhs,Sunak says he can’t afford public sector pay rises – but look at the white elephants he’s happy to fund | Simon Jenkins,Opinion,expert_qual,opinion
https://www.theguardian.com/commentisfree/2025/may/03/human-rights-labour-migration-labour-european-convention-on-human-rights,commentisfree/2025/may/03/human-rights-labour-migration-labour-european-convention-on-human-rights,Does human rights law really stop the UK controlling migration? No – and Keir Starmer knows that | Jamie Burton,Opinion,expert_qual,opinion
https://www.theguardian.com/commentisfree/2023/aug/19/observer-editorial-lucy-letby-statutory-inquiry-nhs-failings,commentisfree/2023/aug/19/observer-editorial-lucy-letby-statutory-inquiry-nhs-failings,The Observer view: only a robust inquiry will hold NHS to account over Lucy Letby murders | Observer editorial,Opinion,expert_qual,opinion
https://www.theguardian.com/media/commentisfree/article/2024/aug/09/linda-reynolds-praises-fair-and-balanced-albrechtsen-but-reveals-she-is-no-fan-of-samantha-maiden-ntwnfb,media/commentisfree/article/2024/aug/09/linda-reynolds-praises-fair-and-balanced-albrechtsen-but-reveals-she-is-no-fan-of-samantha-maiden-ntwnfb,Linda Reynolds praises ‘fair and balanced’ Albrechtsen – but reveals she is no fan of Samantha Maiden | Weekly Beast,Media,expert_qual,opinion
https://www.theguardian.com/commentisfree/2025/jan/06/grooming-scandal-keir-starmer-reform-nigel-farage,commentisfree/2025/jan/06/grooming-scandal-keir-starmer-reform-nigel-farage,This is how the grooming scandal is being weaponised – and this is what Starmer must do | Gaby Hinsliff,Opinion,expert_qual,opinion
https://www.theguardian.com/commentisfree/article/2024/jun/09/your-sermons-on-integrity-are-a-bit-rich-archbishop-given-your-faith-in-paula-vennells,commentisfree/article/2024/jun/09/your-sermons-on-integrity-are-a-bit-rich-archbishop-given-your-faith-in-paula-vennells,"Your sermons on integrity are a bit rich, archbishop, given your faith in Paula Vennells | Catherine Bennett",Opinion,expert_qual,opinion
https://www.theguardian.com/commentisfree/article/2024/jun/21/arundhati-roy-india-bjp-elections-booker-prize,commentisfree/article/2024/jun/21/arundhati-roy-india-bjp-elections-booker-prize,The hounding of Arundhati Roy shows there’s still no room for dissent in India | Salil Tripathi,Opinion,expert_qual,opinion
https://www.theguardian.com/commentisfree/article/2024/jul/28/why-rachel-reeves-wants-everyone-to-know-that-the-tories-left-the-treasury-brassic,commentisfree/article/2024/jul/28/why-rachel-reeves-wants-everyone-to-know-that-the-tories-left-the-treasury-brassic,Why Rachel Reeves wants everyone to know that the Tories left the Treasury brassic | Andrew Rawnsley,Opinion,expert_qual,opinion
https://www.theguardian.com/commentisfree/2024/dec/22/our-rarely-apologise-never-resign-bishops-dont-deserve-comfortable-lives-in-the-lords,commentisfree/2024/dec/22/our-rarely-apologise-never-resign-bishops-dont-deserve-comfortable-lives-in-the-lords,"Our rarely apologise, never resign bishops don’t deserve comfortable lives in the Lords | Catherine Bennett",Opinion,expert_qual,opinion
https://www.theguardian.com/commentisfree/2025/mar/23/arizona-execution-death-penalty,commentisfree/2025/mar/23/arizona-execution-death-penalty,Arizona’s execution pitted experts against politicians. Experts lost | Austin Sarat,Opinion,expert_qual,opinion
https://www.theguardian.com/commentisfree/2024/apr/14/cass-review-gender-identity-services-children-young-people,commentisfree/2024/apr/14/cass-review-gender-identity-services-children-young-people,The Cass review reveals how children were catastrophically failed by the medical profession | Observer editorial,Opinion,expert_qual,opinion
https://www.theguardian.com/commentisfree/2023/oct/22/observer-view-on-gender-dysphoria-criminalising-therapy-poses-risk-tto-childrens-welfare,commentisfree/2023/oct/22/observer-view-on-gender-dysphoria-criminalising-therapy-poses-risk-tto-childrens-welfare,The Observer view on gender dysphoria: criminalising therapy poses a risk to children’s welfare | Observer editorial,Opinion,expert_qual,opinion
https://www.theguardian.com/commentisfree/2022/nov/05/can-labor-provide-cost-of-living-relief-without-feeding-inflation-and-interest-rates-an-expert-panel-responds,commentisfree/2022/nov/05/can-labor-provide-cost-of-living-relief-without-feeding-inflation-and-interest-rates-an-expert-panel-responds,Can Labor provide cost-of-living relief without feeding inflation and interest rates? An expert panel responds,Opinion,expert_qual,opinion
https://www.theguardian.com/commentisfree/2024/mar/10/observer-view-michelle-donolan-false-allegations,commentisfree/2024/mar/10/observer-view-michelle-donolan-false-allegations,Michelle Donelan deserves to lose her job over false allegations against two academics | Observer editorial,Opinion,expert_qual,opinion
https://www.theguardian.com/commentisfree/2024/oct/29/britian-civilised-tory-mp-neil-obrien-antisocial-behaviour-human-rights,commentisfree/2024/oct/29/britian-civilised-tory-mp-neil-obrien-antisocial-behaviour-human-rights,"‘Make Britain vaguely civilised again’? Sounds great – but not the way this Tory MP would do it, thanks | Anne Perkins",Opinion,expert_qual,opinion
https://www.theguardian.com/media/commentisfree/2024/sep/27/news-corp-warns-millions-of-renters-crucified-as-murdoch-papers-fan-negative-gearing-hysteria,media/commentisfree/2024/sep/27/news-corp-warns-millions-of-renters-crucified-as-murdoch-papers-fan-negative-gearing-hysteria,News Corp warns millions of renters ‘crucified’ as Murdoch papers fan negative gearing hysteria | The Weekly Beast,Media,expert_qual,opinion
https://www.theguardian.com/commentisfree/2023/sep/17/teachers-need-guidance-to-resolve-issues-gender-identity-in-classroom,commentisfree/2023/sep/17/teachers-need-guidance-to-resolve-issues-gender-identity-in-classroom,Teachers need guidance to resolve issues of gender identity in the classroom | Sonia Sodha,Opinion,expert_qual,opinion
https://www.theguardian.com/commentisfree/2025/jan/12/grooming-shipman-chilcot-for-all-the-post-inquiry-never-agains-the-default-is-inaction,commentisfree/2025/jan/12/grooming-shipman-chilcot-for-all-the-post-inquiry-never-agains-the-default-is-inaction,"Grooming, Shipman, Chilcot: for all the post-inquiry ‘never agains’, the default is inaction | Isabel Hardman",Opinion,expert_qual,opinion
https://www.theguardian.com/commentisfree/article/2024/may/02/israel-gaza-lies-western-backers,commentisfree/article/2024/may/02/israel-gaza-lies-western-backers,"Which is worse, Israel’s lies about Gaza or its western backers who repeat those lies? | Mehdi Hasan",Opinion,expert_qual,opinion
https://www.theguardian.com/commentisfree/2023/nov/03/covid-tories-old-people-pensions-health-social-care-ageing-population,commentisfree/2023/nov/03/covid-tories-old-people-pensions-health-social-care-ageing-population,"During Covid, callous Tories knew this about old people: they’re very expensive | Polly Toynbee",Opinion,expert_qual,opinion
https://www.theguardian.com/commentisfree/2024/oct/24/armed-police-accountable-chris-kaba,commentisfree/2024/oct/24/armed-police-accountable-chris-kaba,"Armed police have a dangerous job, but that doesn’t mean they should be less accountable | Gaby Hinsliff",Opinion,expert_qual,opinion
https://www.theguardian.com/commentisfree/2024/mar/14/the-crisis-in-gaza-is-a-diplomatic-test-for-australia-we-must-do-better-as-a-country,commentisfree/2024/mar/14/the-crisis-in-gaza-is-a-diplomatic-test-for-australia-we-must-do-better-as-a-country,The crisis in Gaza is a diplomatic test for Australia. We must do better as a country | David Pocock,Opinion,expert_qual,opinion
https://www.theguardian.com/commentisfree/2023/oct/27/mr-speaker-honourable-gentlemen-crispin-blunt-marina-hyde,commentisfree/2023/oct/27/mr-speaker-honourable-gentlemen-crispin-blunt-marina-hyde,"Dear Mr Speaker, what are we to do about the honourable gentlemen for Sexpest North? | Marina Hyde",Opinion,expert_qual,opinion
https://www.theguardian.com/commentisfree/2024/apr/03/the-guardian-view-on-tackling-famine-in-gaza-palestinians-need-unrwa,commentisfree/2024/apr/03/the-guardian-view-on-tackling-famine-in-gaza-palestinians-need-unrwa,The Guardian view on tackling famine in Gaza: Palestinians need Unrwa | Editorial,Opinion,expert_qual,opinion
https://www.theguardian.com/commentisfree/2023/oct/31/the-guardian-view-on-the-covid-inquiry-shocking-failures-under-the-spotlight,commentisfree/2023/oct/31/the-guardian-view-on-the-covid-inquiry-shocking-failures-under-the-spotlight,The Guardian view on the Covid inquiry: shocking failures under the spotlight | Editorial,Opinion,expert_qual,opinion
https://www.theguardian.com/commentisfree/2024/feb/23/stephen-lawrence-macpherson-report-race-politics,commentisfree/2024/feb/23/stephen-lawrence-macpherson-report-race-politics,"Twenty-five years after the Lawrence inquiry, Britain has regressed on race and politicians have made it worse | Nicola Rollock",Opinion,expert_qual,opinion
https://www.theguardian.com/commentisfree/article/2024/aug/23/ndis-funding-changes-australia-comment,commentisfree/article/2024/aug/23/ndis-funding-changes-australia-comment,"For a deafblind woman like me, the NDIS funding changes are a blow. I fear for my future | Jane Britt",Opinion,expert_qual,opinion
https://www.theguardian.com/commentisfree/2023/dec/21/trust-in-mps-house-of-commons-peter-bone-rishi-sunak,commentisfree/2023/dec/21/trust-in-mps-house-of-commons-peter-bone-rishi-sunak,"Britain is a country that looks to its parliament. And the truth is, parliament is failing us | Martin Kettle",Opinion,expert_qual,opinion
https://www.theguardian.com/commentisfree/2023/jul/09/the-guardian-view-on-schools-labours-proposals-rightly-put-the-focus-on-teachers,commentisfree/2023/jul/09/the-guardian-view-on-schools-labours-proposals-rightly-put-the-focus-on-teachers,The Guardian view on schools: Labour’s proposals rightly put the focus on teachers | Editorial,Opinion,expert_qual,opinion
https://www.theguardian.com/commentisfree/2023/jun/11/new-nhs-guidance-could-prevent-same-sex-care-for-women,commentisfree/2023/jun/11/new-nhs-guidance-could-prevent-same-sex-care-for-women,How did NHS body get the law so badly wrong over its rules on same-sex care? | Sonia Sodha,Opinion,expert_qual,opinion
https://www.theguardian.com/commentisfree/2023/sep/26/tory-mp-rishi-sunak-net-zero-economy-chris-skidmore,commentisfree/2023/sep/26/tory-mp-rishi-sunak-net-zero-economy-chris-skidmore,"I’m a Tory MP, but I know Rishi Sunak’s claims about the cost of net zero are false | Chris Skidmore",Opinion,expert_qual,opinion
https://www.theguardian.com/commentisfree/2023/jun/13/covid-inquiry-ministers-scientific-advisers,commentisfree/2023/jun/13/covid-inquiry-ministers-scientific-advisers,Don’t blame scientists for what went wrong with Covid – ministers were the ones calling the shots | Devi Sridhar,Opinion,expert_qual,opinion
https://www.theguardian.com/commentisfree/2024/mar/12/chronic-fatigue-syndrome-me-treatments-social-services,commentisfree/2024/mar/12/chronic-fatigue-syndrome-me-treatments-social-services,‘You don’t want to get better’: the outdated treatment of ME/CFS patients is a national scandal | George Monbiot,Opinion,expert_qual,opinion
https://www.theguardian.com/commentisfree/2023/jul/25/labour-gender-recognition-anneliese-dodds,commentisfree/2023/jul/25/labour-gender-recognition-anneliese-dodds,Labour’s overhaul of gender recognition won’t satisfy either side. But it’s a start | Gaby Hinsliff,Opinion,expert_qual,opinion
https://www.theguardian.com/commentisfree/2022/dec/06/fix-british-politics-labour-westminster-regions,commentisfree/2022/dec/06/fix-british-politics-labour-westminster-regions,Think our plan to fix British politics is a pipe dream? Think again | Gordon Brown,Opinion,expert_qual,opinion
https://www.theguardian.com/commentisfree/2022/dec/10/government-uk-ministers-gifts-mps-standards-chris-bryant,commentisfree/2022/dec/10/government-uk-ministers-gifts-mps-standards-chris-bryant,Why doesn’t the UK government want us to know if ministers have taken gifts and freebies? | Chris Bryant,Opinion,expert_qual,opinion
https://www.theguardian.com/commentisfree/2024/jan/16/the-guardian-view-on-universities-australian-lesson-might-spark-much-needed-change,commentisfree/2024/jan/16/the-guardian-view-on-universities-australian-lesson-might-spark-much-needed-change,The Guardian view on universities: Australian lesson might spark much-needed change | Editorial,Opinion,expert_qual,opinion
https://www.theguardian.com/commentisfree/2023/aug/07/harry-potter-and-the-cursed-child-job-of-a-lifetime-why-i-quit,commentisfree/2023/aug/07/harry-potter-and-the-cursed-child-job-of-a-lifetime-why-i-quit,"Harry Potter and the Cursed Child was the job of a lifetime, and I walked away from it | Gillian Cosgriff",Opinion,expert_qual,opinion
https://www.theguardian.com/commentisfree/2022/dec/29/mccarthyite-blacklist-muslim-groups-gove-prevent-review,commentisfree/2022/dec/29/mccarthyite-blacklist-muslim-groups-gove-prevent-review,The McCarthyite blacklist of Muslim groups Gove wants published should never see the light of day | Miqdaad Versi,Opinion,expert_qual,opinion
https://www.theguardian.com/commentisfree/2015/feb/13/class-size-debate-asks-wrong-question-simplistic,commentisfree/2015/feb/13/class-size-debate-asks-wrong-question-simplistic,"The class sizes debate is tired, and asks the wrong questions  | Peter Blatchford",Opinion,expert_secondary,opinion
https://www.theguardian.com/commentisfree/2025/may/02/trump-yemen-uk-global-pariah-houthis-strike,commentisfree/2025/may/02/trump-yemen-uk-global-pariah-houthis-strike,Militarily cosying up to Trump in Yemen cannot end well for the UK | Paul Rogers,Opinion,gut,opinion
https://www.theguardian.com/commentisfree/2025/mar/04/ukraine-donald-trump-volodymyr-zelenskyy-kyiv-keir-starmer,commentisfree/2025/mar/04/ukraine-donald-trump-volodymyr-zelenskyy-kyiv-keir-starmer,Why this is no time for Zelenskyy to grovel to Trump | Paul Taylor,Opinion,gut,opinion
https://www.theguardian.com/commentisfree/2024/mar/02/if-metas-intransigence-isnt-enough-ai-poses-an-even-greater-threat-to-journalism,commentisfree/2024/mar/02/if-metas-intransigence-isnt-enough-ai-poses-an-even-greater-threat-to-journalism,"If Meta’s intransigence isn’t enough, AI poses an even greater threat to journalism | Margaret Simons",Opinion,gut,opinion
https://www.theguardian.com/commentisfree/article/2024/may/15/rishi-sunak-world-dangerous-election-tories-labour,commentisfree/article/2024/may/15/rishi-sunak-world-dangerous-election-tories-labour,"Yes, Rishi Sunak, the world is a scary place. That is why we need a new prime minister | Rafael Behr",Opinion,gut,opinion
https://www.theguardian.com/commentisfree/2022/dec/20/england-police-decriminalise-hard-drugs-home-office,commentisfree/2022/dec/20/england-police-decriminalise-hard-drugs-home-office,Even England's police want to decriminalise hard drugs – but our posturing politicians won’t listen | Simon Jenkins,Opinion,gut,opinion
https://www.theguardian.com/commentisfree/2022/nov/28/the-guardian-view-on-the-tory-energy-rebellion-get-rid-of-the-onshore-wind-ban,commentisfree/2022/nov/28/the-guardian-view-on-the-tory-energy-rebellion-get-rid-of-the-onshore-wind-ban,The Guardian view on the Tory energy rebellion: get rid of the onshore wind ban | Editorial,Opinion,gut,opinion
https://www.theguardian.com/commentisfree/2021/feb/28/the-observer-view-on-basing-pupils-results-on-teacher-assessment,commentisfree/2021/feb/28/the-observer-view-on-basing-pupils-results-on-teacher-assessment,The Observer view on basing pupils' results on teacher assessment | Observer editorial,Opinion,gut,opinion
https://www.theguardian.com/commentisfree/2021/oct/06/facebook-scandals-social-media,commentisfree/2021/oct/06/facebook-scandals-social-media,Facebook is a harmful presence in our lives. It’s not too late to pull the plug on it | Jathan Sadowski,Opinion,gut,opinion
https://www.theguardian.com/commentisfree/2020/nov/26/why-biden-shouldnt-extend-an-olive-branch-to-republicans,commentisfree/2020/nov/26/why-biden-shouldnt-extend-an-olive-branch-to-republicans,Biden wants to extend an olive branch to Republicans. He shouldn't | Joshua Craze and Ainsley LeSure,Opinion,gut,opinion
https://www.theguardian.com/commentisfree/2019/mar/01/sadiq-khan-racist-minicab-policy-london-mayor-congestion-charge,commentisfree/2019/mar/01/sadiq-khan-racist-minicab-policy-london-mayor-congestion-charge,I backed Sadiq Khan – but now his racist minicab policy has betrayed me | Abdurazak Hadi,Opinion,gut,opinion
https://www.theguardian.com/commentisfree/2019/jun/21/facebooks-plan-to-break-the-global-financial-system,commentisfree/2019/jun/21/facebooks-plan-to-break-the-global-financial-system,Facebook's plan to break the global financial system | Evgeny Morozov,Opinion,gut,opinion
https://www.theguardian.com/commentisfree/2020/may/23/america-children-parents-week-in-patriarchy,commentisfree/2020/may/23/america-children-parents-week-in-patriarchy,"In America, having a baby is becoming a luxury only a few can afford | Arwa Mahdawi",Opinion,gut,opinion
https://www.theguardian.com/commentisfree/2018/oct/07/lets-dance-like-it-was-the-1970s-all-over-again-who-will-have-a-hit-with-this,commentisfree/2018/oct/07/lets-dance-like-it-was-the-1970s-all-over-again-who-will-have-a-hit-with-this,"Let’s dance, like it was the 1970s all over again. Who will have a hit with this? | Andrew Rawnsley",Opinion,gut,opinion
https://www.theguardian.com/commentisfree/2018/apr/15/the-guardian-view-on-bombing-syria-a-decision-for-parliament,commentisfree/2018/apr/15/the-guardian-view-on-bombing-syria-a-decision-for-parliament,The Guardian view on bombing Syria: a decision for parliament | Editorial,Opinion,gut,opinion
https://www.theguardian.com/commentisfree/2019/apr/14/white-paper-online-harms-global-first-needed-tech-industry-dcms-google-facebook,commentisfree/2019/apr/14/white-paper-online-harms-global-first-needed-tech-industry-dcms-google-facebook,The white paper on online harms is a global first. It has never been more needed | John Naughton,Opinion,gut,opinion
https://www.theguardian.com/commentisfree/2017/dec/04/the-guardian-view-on-green-toryism-it-must-go-beyond-gimmicks,commentisfree/2017/dec/04/the-guardian-view-on-green-toryism-it-must-go-beyond-gimmicks,The Guardian view on Green Toryism: it must go beyond gimmicks | Editorial,Opinion,gut,opinion
https://www.theguardian.com/commentisfree/2018/may/13/take-r-kellys-smug-face-off-spotify-altogether,commentisfree/2018/may/13/take-r-kellys-smug-face-off-spotify-altogether,Take R Kelly’s smug face off Spotify altogether | Charlie Brinkhurst-Cuff,Opinion,gut,opinion
https://www.theguardian.com/commentisfree/2019/feb/04/trump-set-low-bar-deluded-billionaires-flirting-with-a-2020-run,commentisfree/2019/feb/04/trump-set-low-bar-deluded-billionaires-flirting-with-a-2020-run,Trump set a low bar for other deluded billionaires flirting with a 2020 run | Jill Abramson,Opinion,gut,opinion
https://www.theguardian.com/commentisfree/2018/apr/23/the-guardian-view-on-macron-in-washington-a-need-for-results,commentisfree/2018/apr/23/the-guardian-view-on-macron-in-washington-a-need-for-results,The Guardian view on Macron in Washington: a need for results | Editorial,Opinion,gut,opinion
https://www.theguardian.com/commentisfree/2018/jul/31/zuckerberg-haters-social-media-giants,commentisfree/2018/jul/31/zuckerberg-haters-social-media-giants,Ignore Zuckerberg. With skill and imagination we can drive the haters offline | Zoe Williams,Opinion,gut,opinion
https://www.theguardian.com/commentisfree/2018/jul/18/dark-money-democracy-political-crisis-institute-economic-affairs,commentisfree/2018/jul/18/dark-money-democracy-political-crisis-institute-economic-affairs,Dark money lurks at the heart of our political crisis | George Monbiot,Opinion,gut,opinion
https://www.theguardian.com/commentisfree/2018/jul/12/eu-britain-brexit-plan-chequers-theresa-may,commentisfree/2018/jul/12/eu-britain-brexit-plan-chequers-theresa-may,"Dear EU, please take Britain’s Brexit plan seriously. It may be our best offer | Henry Newman",Opinion,gut,opinion
https://www.theguardian.com/commentisfree/2017/apr/19/opponents-of-safe-schools-are-scared-the-world-is-moving-on-without-them,commentisfree/2017/apr/19/opponents-of-safe-schools-are-scared-the-world-is-moving-on-without-them,Opponents of Safe Schools are scared because the world is moving on without them | Catharine Lumby,Opinion,gut,opinion
https://www.theguardian.com/commentisfree/2017/may/11/trump-administration-diversity-race-gender,commentisfree/2017/may/11/trump-administration-diversity-race-gender,The Trump administration has an interesting definition of diversity | Arwa Mahdawi,Opinion,gut,opinion
https://www.theguardian.com/commentisfree/2016/oct/26/wallonia-hard-brexit-belgian-wales-scotland,commentisfree/2016/oct/26/wallonia-hard-brexit-belgian-wales-scotland,The lesson from tiny Wallonia – there is a way to prevent hard Brexit | Simon Jenkins,Opinion,gut,opinion
https://www.theguardian.com/commentisfree/2016/sep/27/pupil-data-collection-scheme-dangerous-threat-children-safety-teacher-parent,commentisfree/2016/sep/27/pupil-data-collection-scheme-dangerous-threat-children-safety-teacher-parent,Scrap this pupil data collection: it’s a divisive threat to our children’s safety | Dermot Bryers,Opinion,gut,opinion
https://www.theguardian.com/commentisfree/2017/mar/30/snoops-buy-your-browsing-history-us-congress,commentisfree/2017/mar/30/snoops-buy-your-browsing-history-us-congress,Snoops may soon be able to buy your browsing history. Thank the US Congress | Bruce Schneier,Opinion,gut,opinion
https://www.theguardian.com/commentisfree/2016/mar/31/animal-welfare-deregulation-farming-industry-liz-truss,commentisfree/2016/mar/31/animal-welfare-deregulation-farming-industry-liz-truss,Handing animal welfare to the farming industry is a big backward step | Philip Lymbery,Opinion,gut,opinion
https://www.theguardian.com/commentisfree/2015/may/04/open-thread-mcdonalds-turnaround-plan,commentisfree/2015/may/04/open-thread-mcdonalds-turnaround-plan,Is there hope for McDonald's? Or are you finished with lovin' it?,Opinion,gut,opinion
https://www.theguardian.com/commentisfree/2015/aug/28/dont-believe-the-hype-coal-employs-fewer-than-mcdonalds,commentisfree/2015/aug/28/dont-believe-the-hype-coal-employs-fewer-than-mcdonalds,Don't believe the hype. Coal employs fewer people than McDonald's | Ben Oquist,Opinion,gut,opinion
https://www.theguardian.com/commentisfree/2014/nov/26/ferguson-congress-military-police-streets,commentisfree/2014/nov/26/ferguson-congress-military-police-streets,Why does Ferguson still look like Iraq? Congress can stop the military police | Rep Hank Johnson,Opinion,gut,opinion
https://www.theguardian.com/commentisfree/2014/oct/29/the-uk-is-now-turning-its-back-on-migrants-dying-at-sea-have-we-learned-nothing-from-australia,commentisfree/2014/oct/29/the-uk-is-now-turning-its-back-on-migrants-dying-at-sea-have-we-learned-nothing-from-australia,The UK is now turning its back on migrants dying at sea – have we learned nothing from Australia? | Paola Totaro,Opinion,gut,opinion
https://www.theguardian.com/commentisfree/2014/jun/11/guinea-pigs-michael-gove-model-madrasas-our-children-experiment-education-policy,commentisfree/2014/jun/11/guinea-pigs-michael-gove-model-madrasas-our-children-experiment-education-policy,The guinea pigs in Gove's model madrasas are our children. We never agreed to this experiment | Suzanne Moore,Opinion,gut,opinion
https://www.theguardian.com/commentisfree/2014/may/13/budget-2014-panel,commentisfree/2014/may/13/budget-2014-panel,Australian Budget 2014: the panel verdict,Opinion,gut,opinion
https://www.theguardian.com/commentisfree/2013/apr/23/regulated-market-nhs-competition,commentisfree/2013/apr/23/regulated-market-nhs-competition,"Why I, a Labour peer, am supporting a regulated market for NHS competition | Norman Warner",Opinion,gut,opinion
https://www.theguardian.com/commentisfree/2014/apr/21/great-britain-little-england-europe-eu-lib-dem-win,commentisfree/2014/apr/21/great-britain-little-england-europe-eu-lib-dem-win,Where would you rather live – Great Britain or little England? | Nick Clegg,Opinion,gut,opinion
https://www.theguardian.com/commentisfree/2013/may/08/minimum-pricing-alcohol-red-faced-ranters,commentisfree/2013/may/08/minimum-pricing-alcohol-red-faced-ranters,Minimum pricing for alcohol: the red-faced ranters have won | Katherine Brown,Opinion,gut,opinion
https://www.theguardian.com/commentisfree/2013/jun/28/human-genetics-life-science-editorial,commentisfree/2013/jun/28/human-genetics-life-science-editorial,Human genetics: life science | Editorial,Opinion,gut,opinion
