url,title,classified_method,secondary_method,method_certainty,article_relevance_score,models_agreeing_high,disagreement_type,m1_decision_p1,m2old_decision_p1,m2new_decision_p1,m3_decision_p1,m4_decision_p1,m5_decision_p1,m6_decision_p1
https://www.theguardian.com/uk-news/2021/sep/19/scottish-covid-vaccine-trialists-treated-like-second-class-citizens,Scottish Covid vaccine trialists ‘treated like second-class citizens’,method_gut,method_expert_qual,LOW,0.18271426267784358,2,method_disagree,0.8,0.05,0.05,0.7040576899180571,0.28109764943073584,0.2027001827955246,0.15000000000000002
https://www.theguardian.com/society/2021/may/21/novavax-volunteers-in-uk-threaten-to-quit-over-approval-delays,Novavax volunteers in UK threaten to quit over approval delays,method_gut,method_rct,LOW,0.20963101701671233,2,method_disagree,0.8,0.05,0.05,0.6560835812589676,0.4436995299530568,0.32981419563293457,0.2
https://www.theguardian.com/world/2021/dec/31/omicron-fuelled-fourth-covid-wave-has-passed-says-south-africa-as-it-eases-restrictions,"Omicron-fuelled fourth Covid wave has passed, says South Africa, as it eases restrictions  ",method_gut,method_prepost,LOW,0.2527521714070116,3,method_disagree,0.8,0.2,0.8,0.4404308104318102,0.3474304970198849,0.08754510432481766,0.35
https://www.theguardian.com/world/2021/jan/08/moderna-covid-vaccine-approved-for-use-by-uk-medicines-regulator,Moderna Covid vaccine approved for use in UK,method_rct,,MEDIUM,0.15830651145339192,2,near_tier_a,0.05,0.05,0.2,0.619346416475524,0.514039337064812,0.4617053270339966,0.25
https://www.theguardian.com/australia-news/2022/may/10/more-than-half-of-prescriptions-for-medicinal-cannabis-in-australia-given-in-queensland-study-says,"More than half of prescriptions for medicinal cannabis in Australia given in Queensland, study says",method_expert_secondary,method_rct,LOW,0.23692938778582368,3,method_disagree,0.8,0.2,0.2,0.5866070896574372,0.5343867116236858,0.28972354531288147,0.25
https://www.theguardian.com/us-news/2022/jul/22/paxlovid-covid-antiviral-drug-biden-fauci,"Paxlovid going underused due to doctors’ ‘misperceptions’, experts say",method_gut,,LOW,0.17296062679148516,1,outlier_high,0.8,0.05,0.05,0.6202957976684108,0.28109764943073584,0.04325562343001366,0.15000000000000002
https://www.theguardian.com/world/2021/aug/26/arkansas-jail-dosing-inmates-ivermectin-covid,Covid: Arkansas jail dosing inmates with ivermectin in spite of FDA warnings,method_gut,,LOW,0.14457508931029067,1,outlier_high,0.8,0.05,0.2,0.4463272416504591,0.28109764943073584,0.07470425963401794,0.1
https://www.theguardian.com/us-news/2021/aug/10/us-covid-vaccine-children-under-12-cases,US urged to fast-track vaccine approval for children under 12 as cases rise,method_expert_secondary,,LOW,0.2012839996218383,1,outlier_high,0.8,0.2,0.05,0.6278299010294799,0.40309473602057727,0.2941799759864807,0.25
