url,title,classified_method,secondary_method,method_certainty,article_relevance_score,models_agreeing_high,disagreement_type,m1_decision_p1,m2old_decision_p1,m2new_decision_p1,m3_decision_p1,m4_decision_p1,m5_decision_p1,m6_decision_p1
https://www.theguardian.com/world/2022/mar/14/covid-biden-new-covid-initiative-wont-work-pharmacists,Test to Treat: pharmacists say Biden’s major new Covid initiative won’t work,method_gut,method_rct,LOW,0.33120815551989524,3,method_disagree,0.8,0.2,0.8,0.6770179274485139,0.39108106230002604,0.563083827495575,0.15000000000000002
https://www.theguardian.com/us-news/2022/jan/15/corbevax-covid-vaccine-texas-scientists,"Texas scientists’ new Covid-19 vaccine is cheaper, easier to make and patent-free",method_rct,,MEDIUM,0.21515645489855653,2,near_tier_a,0.05,0.8,0.05,0.6237374487106566,0.28109764943073584,0.4934947192668915,0.15000000000000002
https://www.theguardian.com/commentisfree/2021/dec/08/booster-protect-omicron-pandemic-vaccines,A booster may help protect you from Omicron – but it won’t end the pandemic,method_expert_qual,,LOW,0.12733309042065857,1,outlier_high,0.8,0.2,0.05,0.6401236350239325,0.3302141311319168,0.25996482372283936,0.35
https://www.theguardian.com/society/2021/dec/06/viagra-could-be-used-to-treat-alzheimers-disease-study-finds,"Viagra could be used to treat Alzheimer’s disease, study finds",method_rct,method_prepost,LOW,0.15210473636197744,1,outlier_high,0.2,0.2,0.05,0.505008369427443,0.42440329875439564,0.5236178636550903,0.15000000000000002
https://www.theguardian.com/world/2021/oct/01/latest-developments-in-medical-treatment-for-coronavirus,Coronavirus treatments: the potential ‘game-changers’ in development,method_rct,,MEDIUM,0.19913764334424586,2,near_tier_a,0.2,0.05,0.05,0.6591994405724764,0.4436995299530568,0.5826687812805176,0.44999999999999996
https://www.theguardian.com/society/2021/sep/26/psychedelics-renaissance-new-wave-of-research-puts-hallucinogenics-forward-to-treat-mental-health,‘Psychedelics renaissance’: new wave of research puts hallucinogenics forward to treat mental health ,method_case_study,,LOW,0.13777758639534088,1,outlier_high,0.8,0.05,0.05,0.3955393418729862,0.28109764943073584,0.09742507338523865,0.15000000000000002
https://www.theguardian.com/world/2021/sep/24/ivermectin-covid-peru-misinformation,"Desperation, misinformation: how the ivermectin craze spread across the world",method_case_study,method_gut,LOW,0.1591285649125837,1,outlier_high,0.8,0.2,0.2,0.47563563226623917,0.35143745654249103,0.08597756922245026,0.15000000000000002
https://www.theguardian.com/science/2021/sep/23/scientists-use-ai-to-create-drug-regime-for-rare-form-of-brain-cancer-in-children,Scientists use AI to create drug regime for rare form of brain cancer in children,method_rct,method_prepost,LOW,0.21879729092398612,1,outlier_high,0.2,0.8,0.2,0.6166695454137998,0.42440329875439564,0.14790543913841248,0.15000000000000002
https://www.theguardian.com/society/2021/aug/09/normal-life-ms-patient-denied-life-changing-drug-nhs-postcode-lottery,‘It’s difficult to live a normal life’: MS patient denied drug in NHS postcode lottery,method_case_study,,LOW,0.22375974617882677,1,outlier_high,0.8,0.2,0.2,0.5552056711106769,0.4436995299530568,0.19686992466449738,0.25
